2026-07-16T11:05:54.04245178Z stderr F + yum install -y tcpdump
2026-07-16T11:05:56.379329279Z stdout F CentOS Stream 10 - BaseOS                       3.5 MB/s | 7.0 MB     00:02    
2026-07-16T11:05:59.428927115Z stdout F CentOS Stream 10 - AppStream                    1.6 MB/s | 3.6 MB     00:02    
2026-07-16T11:06:01.465949426Z stdout F CentOS Stream 10 - Extras packages               14 kB/s |  10 kB     00:00    
2026-07-16T11:06:02.115084513Z stdout F Dependencies resolved.
2026-07-16T11:06:02.115859781Z stdout F ================================================================================
2026-07-16T11:06:02.115869349Z stdout F  Package          Architecture Version                    Repository       Size
2026-07-16T11:06:02.115873436Z stdout F ================================================================================
2026-07-16T11:06:02.115876893Z stdout F Installing:
2026-07-16T11:06:02.115879818Z stdout F  tcpdump          x86_64       14:4.99.4-10.el10          appstream       503 k
2026-07-16T11:06:02.115884036Z stdout F Installing dependencies:
2026-07-16T11:06:02.115887503Z stdout F  libibverbs       x86_64       62.0-2.el10                baseos          484 k
2026-07-16T11:06:02.115890769Z stdout F  libnl3           x86_64       3.11.0-1.el10              baseos          361 k
2026-07-16T11:06:02.115894185Z stdout F  libpcap          x86_64       14:1.10.4-7.el10           baseos          175 k
2026-07-16T11:06:02.115897051Z stdout F 
2026-07-16T11:06:02.115900176Z stdout F Transaction Summary
2026-07-16T11:06:02.115903593Z stdout F ================================================================================
2026-07-16T11:06:02.115906829Z stdout F Install  4 Packages
2026-07-16T11:06:02.115909544Z stdout F 
2026-07-16T11:06:02.116286267Z stdout F Total download size: 1.5 M
2026-07-16T11:06:02.116353314Z stdout F Installed size: 3.9 M
2026-07-16T11:06:02.116788385Z stdout F Downloading Packages:
2026-07-16T11:06:03.100650895Z stdout F (1/4): libpcap-1.10.4-7.el10.x86_64.rpm         661 kB/s | 175 kB     00:00    
2026-07-16T11:06:03.108813904Z stdout F (2/4): libnl3-3.11.0-1.el10.x86_64.rpm          1.3 MB/s | 361 kB     00:00    
2026-07-16T11:06:03.113561894Z stdout F (3/4): libibverbs-62.0-2.el10.x86_64.rpm        1.7 MB/s | 484 kB     00:00    
2026-07-16T11:06:03.353544951Z stdout F (4/4): tcpdump-4.99.4-10.el10.x86_64.rpm        1.9 MB/s | 503 kB     00:00    
2026-07-16T11:06:03.355925748Z stdout F --------------------------------------------------------------------------------
2026-07-16T11:06:03.355986752Z stdout F Total                                           1.2 MB/s | 1.5 MB     00:01     
2026-07-16T11:06:03.370235459Z stdout F CentOS Stream 10 - BaseOS                       1.6 MB/s | 1.6 kB     00:00    
2026-07-16T11:06:03.373421481Z stderr F Importing GPG key 0x8483C65D:
2026-07-16T11:06:03.373433734Z stderr F  Userid     : "CentOS (CentOS Official Signing Key) <security@centos.org>"
2026-07-16T11:06:03.373437921Z stderr F  Fingerprint: 99DB 70FA E1D7 CE22 7FB6 4882 05B5 55B3 8483 C65D
2026-07-16T11:06:03.373441809Z stderr F  From       : /etc/pki/rpm-gpg/RPM-GPG-KEY-centosofficial-SHA256
2026-07-16T11:06:03.397269089Z stdout F Key imported successfully
2026-07-16T11:06:03.447817197Z stdout F Running transaction check
2026-07-16T11:06:03.45781338Z stdout F Transaction check succeeded.
2026-07-16T11:06:03.457947481Z stdout F Running transaction test
2026-07-16T11:06:03.494840789Z stdout F Transaction test succeeded.
2026-07-16T11:06:03.495290198Z stdout F Running transaction
2026-07-16T11:06:03.564382881Z stdout F   Preparing        :                                                        1/1 
2026-07-16T11:06:03.59019968Z stdout F   Installing       : libnl3-3.11.0-1.el10.x86_64                            1/4 
2026-07-16T11:06:03.598825593Z stdout F   Installing       : libibverbs-62.0-2.el10.x86_64                          2/4 
2026-07-16T11:06:03.601440708Z stdout F   Installing       : libpcap-14:1.10.4-7.el10.x86_64                        3/4 
2026-07-16T11:06:03.627139735Z stdout F   Running scriptlet: tcpdump-14:4.99.4-10.el10.x86_64                       4/4 
2026-07-16T11:06:03.62716918Z stdout F useradd: Warning: missing or non-executable shell '/usr/sbin/nologin'
2026-07-16T11:06:03.627173037Z stdout F 
2026-07-16T11:06:03.646805233Z stdout F   Installing       : tcpdump-14:4.99.4-10.el10.x86_64                       4/4 
2026-07-16T11:06:03.749416445Z stdout F   Running scriptlet: tcpdump-14:4.99.4-10.el10.x86_64                       4/4 
2026-07-16T11:06:03.749439939Z stdout F 
2026-07-16T11:06:03.749445569Z stdout F Installed:
2026-07-16T11:06:03.749470977Z stdout F   libibverbs-62.0-2.el10.x86_64          libnl3-3.11.0-1.el10.x86_64            
2026-07-16T11:06:03.749478711Z stdout F   libpcap-14:1.10.4-7.el10.x86_64        tcpdump-14:4.99.4-10.el10.x86_64       
2026-07-16T11:06:03.749484021Z stdout F 
2026-07-16T11:06:03.749489571Z stdout F Complete!
2026-07-16T11:06:03.795965968Z stderr F + nsenter --net=/var/run/netns/perouter tcpdump -e -nn -i any tcp port 179 or udp port 4789 or tcp port 8090
2026-07-16T11:06:03.810733093Z stderr F tcpdump: data link type LINUX_SLL2
2026-07-16T11:06:03.810974064Z stderr F dropped privs to tcpdump
2026-07-16T11:06:03.811097304Z stderr F tcpdump: verbose output suppressed, use -v[v]... for full protocol decode
2026-07-16T11:06:03.811121649Z stderr F listening on any, link-type LINUX_SLL2 (Linux cooked v2), snapshot length 262144 bytes
2026-07-16T11:07:39.073001116Z stdout F 11:07:37.789820 toswitch1 In  ifindex 84 aa:c1:ab:c8:85:5f ethertype IPv4 (0x0800), length 80: 192.168.11.2.46582 > 192.168.11.3.179: Flags [S], seq 401775693, win 56760, options [mss 9460,sackOK,TS val 1281666407 ecr 0,nop,wscale 7], length 0
2026-07-16T11:07:39.073022596Z stdout F 11:07:37.789823 tap_toswitch1 Out ifindex 3 aa:c1:ab:c8:85:5f ethertype IPv4 (0x0800), length 80: 192.168.11.2.46582 > 192.168.11.3.179: Flags [S], seq 401775693, win 56760, options [mss 9460,sackOK,TS val 1281666407 ecr 0,nop,wscale 7], length 0
2026-07-16T11:07:39.073028397Z stdout F 11:07:37.790311 u_toswitch1 In  ifindex 4 aa:c1:ab:ff:b4:69 ethertype IPv4 (0x0800), length 80: 192.168.11.2.46582 > 192.168.11.3.179: Flags [S], seq 401775693, win 56760, options [mss 9460,sackOK,TS val 1281666407 ecr 0,nop,wscale 7], length 0
2026-07-16T11:07:39.073033877Z stdout F 11:07:37.790332 main  Out ifindex 2 ethertype IPv4 (0x0800), length 60: 192.168.11.3.179 > 192.168.11.2.46582: Flags [R.], seq 0, ack 401775694, win 0, length 0
2026-07-16T11:07:39.073039267Z stdout F 11:07:37.790786 tap_toswitch1 P   ifindex 3 aa:c1:ab:ff:b4:69 ethertype IPv4 (0x0800), length 60: 192.168.11.3.179 > 192.168.11.2.46582: Flags [R.], seq 0, ack 1, win 0, length 0
2026-07-16T11:07:39.073044437Z stdout F 11:07:37.790791 toswitch1 Out ifindex 84 aa:c1:ab:ff:b4:69 ethertype IPv4 (0x0800), length 60: 192.168.11.3.179 > 192.168.11.2.46582: Flags [R.], seq 0, ack 1, win 0, length 0
2026-07-16T11:07:39.073049426Z stdout F 11:07:38.801815 toswitch2 In  ifindex 67 aa:c1:ab:63:fb:8f ethertype IPv4 (0x0800), length 80: 192.168.12.2.59634 > 192.168.12.3.179: Flags [S], seq 554106304, win 56760, options [mss 9460,sackOK,TS val 3958803763 ecr 0,nop,wscale 7], length 0
2026-07-16T11:07:39.073054506Z stdout F 11:07:38.801818 tap_toswitch2 Out ifindex 5 aa:c1:ab:63:fb:8f ethertype IPv4 (0x0800), length 80: 192.168.12.2.59634 > 192.168.12.3.179: Flags [S], seq 554106304, win 56760, options [mss 9460,sackOK,TS val 3958803763 ecr 0,nop,wscale 7], length 0
2026-07-16T11:07:39.073059775Z stdout F 11:07:38.803769 u_toswitch2 In  ifindex 6 aa:c1:ab:c8:ba:6e ethertype IPv4 (0x0800), length 80: 192.168.12.2.59634 > 192.168.12.3.179: Flags [S], seq 554106304, win 56760, options [mss 9460,sackOK,TS val 3958803763 ecr 0,nop,wscale 7], length 0
2026-07-16T11:07:39.073064665Z stdout F 11:07:38.803794 main  Out ifindex 2 ethertype IPv4 (0x0800), length 80: 192.168.12.3.179 > 192.168.12.2.59634: Flags [S.], seq 3962365507, ack 554106305, win 65160, options [mss 1460,sackOK,TS val 1268627297 ecr 3958803763,nop,wscale 7], length 0
2026-07-16T11:07:39.073069914Z stdout F 11:07:38.804290 tap_toswitch2 P   ifindex 5 aa:c1:ab:c8:ba:6e ethertype IPv4 (0x0800), length 80: 192.168.12.3.179 > 192.168.12.2.59634: Flags [S.], seq 3962365507, ack 554106305, win 65160, options [mss 1460,sackOK,TS val 1268627297 ecr 3958803763,nop,wscale 7], length 0
2026-07-16T11:07:39.073578775Z stdout F 11:07:38.804294 toswitch2 Out ifindex 67 aa:c1:ab:c8:ba:6e ethertype IPv4 (0x0800), length 80: 192.168.12.3.179 > 192.168.12.2.59634: Flags [S.], seq 3962365507, ack 554106305, win 65160, options [mss 1460,sackOK,TS val 1268627297 ecr 3958803763,nop,wscale 7], length 0
2026-07-16T11:07:39.073588162Z stdout F 11:07:38.804327 toswitch2 In  ifindex 67 aa:c1:ab:63:fb:8f ethertype IPv4 (0x0800), length 72: 192.168.12.2.59634 > 192.168.12.3.179: Flags [.], ack 1, win 444, options [nop,nop,TS val 3958803765 ecr 1268627297], length 0
2026-07-16T11:07:39.07359219Z stdout F 11:07:38.804330 tap_toswitch2 Out ifindex 5 aa:c1:ab:63:fb:8f ethertype IPv4 (0x0800), length 72: 192.168.12.2.59634 > 192.168.12.3.179: Flags [.], ack 1, win 444, options [nop,nop,TS val 3958803765 ecr 1268627297], length 0
2026-07-16T11:07:39.073595626Z stdout F 11:07:38.804580 toswitch2 In  ifindex 67 aa:c1:ab:63:fb:8f ethertype IPv4 (0x0800), length 210: 192.168.12.2.59634 > 192.168.12.3.179: Flags [P.], seq 1:139, ack 1, win 444, options [nop,nop,TS val 3958803766 ecr 1268627297], length 138: BGP
2026-07-16T11:07:39.073598932Z stdout F 11:07:38.804583 tap_toswitch2 Out ifindex 5 aa:c1:ab:63:fb:8f ethertype IPv4 (0x0800), length 210: 192.168.12.2.59634 > 192.168.12.3.179: Flags [P.], seq 1:139, ack 1, win 444, options [nop,nop,TS val 3958803766 ecr 1268627297], length 138: BGP
2026-07-16T11:07:39.073602459Z stdout F 11:07:38.805809 u_toswitch2 In  ifindex 6 aa:c1:ab:c8:ba:6e ethertype IPv4 (0x0800), length 72: 192.168.12.2.59634 > 192.168.12.3.179: Flags [.], ack 1, win 444, options [nop,nop,TS val 3958803765 ecr 1268627297], length 0
2026-07-16T11:07:41.120994765Z stdout F 11:07:38.805972 u_toswitch2 In  ifindex 6 aa:c1:ab:c8:ba:6e ethertype IPv4 (0x0800), length 210: 192.168.12.2.59634 > 192.168.12.3.179: Flags [P.], seq 1:139, ack 1, win 444, options [nop,nop,TS val 3958803766 ecr 1268627297], length 138: BGP
2026-07-16T11:07:41.121018299Z stdout F 11:07:38.805983 main  Out ifindex 2 ethertype IPv4 (0x0800), length 72: 192.168.12.3.179 > 192.168.12.2.59634: Flags [.], ack 139, win 508, options [nop,nop,TS val 1268627299 ecr 3958803766], length 0
2026-07-16T11:07:41.121024261Z stdout F 11:07:38.806025 tap_toswitch2 P   ifindex 5 aa:c1:ab:c8:ba:6e ethertype IPv4 (0x0800), length 72: 192.168.12.3.179 > 192.168.12.2.59634: Flags [.], ack 139, win 508, options [nop,nop,TS val 1268627299 ecr 3958803766], length 0
2026-07-16T11:07:41.121029841Z stdout F 11:07:38.806029 toswitch2 Out ifindex 67 aa:c1:ab:c8:ba:6e ethertype IPv4 (0x0800), length 72: 192.168.12.3.179 > 192.168.12.2.59634: Flags [.], ack 139, win 508, options [nop,nop,TS val 1268627299 ecr 3958803766], length 0
2026-07-16T11:07:41.121035632Z stdout F 11:07:38.806217 main  Out ifindex 2 ethertype IPv4 (0x0800), length 72: 192.168.12.3.179 > 192.168.12.2.59634: Flags [R.], seq 1, ack 139, win 508, options [nop,nop,TS val 1268627299 ecr 3958803766], length 0
2026-07-16T11:07:41.121040731Z stdout F 11:07:38.806393 tap_toswitch2 P   ifindex 5 aa:c1:ab:c8:ba:6e ethertype IPv4 (0x0800), length 72: 192.168.12.3.179 > 192.168.12.2.59634: Flags [R.], seq 1, ack 139, win 508, options [nop,nop,TS val 1268627299 ecr 3958803766], length 0
2026-07-16T11:07:41.121045741Z stdout F 11:07:38.806397 toswitch2 Out ifindex 67 aa:c1:ab:c8:ba:6e ethertype IPv4 (0x0800), length 72: 192.168.12.3.179 > 192.168.12.2.59634: Flags [R.], seq 1, ack 139, win 508, options [nop,nop,TS val 1268627299 ecr 3958803766], length 0
2026-07-16T11:07:41.121149164Z stdout F 11:07:40.831828 main  Out ifindex 2 ethertype IPv4 (0x0800), length 80: 192.168.11.3.46828 > 192.168.11.2.179: Flags [S], seq 3089241983, win 64240, options [mss 1460,sackOK,TS val 2681757173 ecr 0,nop,wscale 7], length 0
2026-07-16T11:07:41.121155936Z stdout F 11:07:40.831959 main  Out ifindex 2 ethertype IPv4 (0x0800), length 80: 192.168.12.3.33310 > 192.168.12.2.179: Flags [S], seq 2364316498, win 64240, options [mss 1460,sackOK,TS val 1268629325 ecr 0,nop,wscale 7], length 0
2026-07-16T11:07:41.121171686Z stdout F 11:07:40.832011 tap_toswitch1 P   ifindex 3 aa:c1:ab:ff:b4:69 ethertype IPv4 (0x0800), length 80: 192.168.11.3.46828 > 192.168.11.2.179: Flags [S], seq 3089241983, win 64240, options [mss 1460,sackOK,TS val 2681757173 ecr 0,nop,wscale 7], length 0
2026-07-16T11:07:41.121174902Z stdout F 11:07:40.832020 toswitch1 Out ifindex 84 aa:c1:ab:ff:b4:69 ethertype IPv4 (0x0800), length 80: 192.168.11.3.46828 > 192.168.11.2.179: Flags [S], seq 3089241983, win 64240, options [mss 1460,sackOK,TS val 2681757173 ecr 0,nop,wscale 7], length 0
2026-07-16T11:07:41.121183788Z stdout F 11:07:40.832069 toswitch1 In  ifindex 84 aa:c1:ab:c8:85:5f ethertype IPv4 (0x0800), length 80: 192.168.11.2.179 > 192.168.11.3.46828: Flags [S.], seq 862106449, ack 3089241984, win 56688, options [mss 9460,sackOK,TS val 1281669449 ecr 2681757173,nop,wscale 7], length 0
2026-07-16T11:07:41.121187255Z stdout F 11:07:40.832075 tap_toswitch1 Out ifindex 3 aa:c1:ab:c8:85:5f ethertype IPv4 (0x0800), length 80: 192.168.11.2.179 > 192.168.11.3.46828: Flags [S.], seq 862106449, ack 3089241984, win 56688, options [mss 9460,sackOK,TS val 1281669449 ecr 2681757173,nop,wscale 7], length 0
2026-07-16T11:07:41.121190812Z stdout F 11:07:40.832115 tap_toswitch2 P   ifindex 5 aa:c1:ab:c8:ba:6e ethertype IPv4 (0x0800), length 80: 192.168.12.3.33310 > 192.168.12.2.179: Flags [S], seq 2364316498, win 64240, options [mss 1460,sackOK,TS val 1268629325 ecr 0,nop,wscale 7], length 0
2026-07-16T11:07:41.121193967Z stdout F 11:07:40.832120 toswitch2 Out ifindex 67 aa:c1:ab:c8:ba:6e ethertype IPv4 (0x0800), length 80: 192.168.12.3.33310 > 192.168.12.2.179: Flags [S], seq 2364316498, win 64240, options [mss 1460,sackOK,TS val 1268629325 ecr 0,nop,wscale 7], length 0
2026-07-16T11:07:41.121197184Z stdout F 11:07:40.832154 toswitch2 In  ifindex 67 aa:c1:ab:63:fb:8f ethertype IPv4 (0x0800), length 80: 192.168.12.2.179 > 192.168.12.3.33310: Flags [S.], seq 3843647621, ack 2364316499, win 56688, options [mss 9460,sackOK,TS val 3958805793 ecr 1268629325,nop,wscale 7], length 0
2026-07-16T11:07:41.121200049Z stdout F 11:07:40.832158 tap_toswitch2 Out ifindex 5 aa:c1:ab:63:fb:8f ethertype IPv4 (0x0800), length 80: 192.168.12.2.179 > 192.168.12.3.33310: Flags [S.], seq 3843647621, ack 2364316499, win 56688, options [mss 9460,sackOK,TS val 3958805793 ecr 1268629325,nop,wscale 7], length 0
2026-07-16T11:07:41.121282393Z stdout F 11:07:40.833512 u_toswitch1 In  ifindex 4 aa:c1:ab:ff:b4:69 ethertype IPv4 (0x0800), length 80: 192.168.11.2.179 > 192.168.11.3.46828: Flags [S.], seq 862106449, ack 3089241984, win 56688, options [mss 9460,sackOK,TS val 1281669449 ecr 2681757173,nop,wscale 7], length 0
2026-07-16T11:07:41.121287863Z stdout F 11:07:40.833542 main  Out ifindex 2 ethertype IPv4 (0x0800), length 72: 192.168.11.3.46828 > 192.168.11.2.179: Flags [.], ack 1, win 502, options [nop,nop,TS val 2681757175 ecr 1281669449], length 0
2026-07-16T11:07:41.121292041Z stdout F 11:07:40.833572 u_toswitch2 In  ifindex 6 aa:c1:ab:c8:ba:6e ethertype IPv4 (0x0800), length 80: 192.168.12.2.179 > 192.168.12.3.33310: Flags [S.], seq 3843647621, ack 2364316499, win 56688, options [mss 9460,sackOK,TS val 3958805793 ecr 1268629325,nop,wscale 7], length 0
2026-07-16T11:07:41.121295127Z stdout F 11:07:40.833584 main  Out ifindex 2 ethertype IPv4 (0x0800), length 72: 192.168.12.3.33310 > 192.168.12.2.179: Flags [.], ack 1, win 502, options [nop,nop,TS val 1268629327 ecr 3958805793], length 0
2026-07-16T11:07:41.121298523Z stdout F 11:07:40.833713 tap_toswitch1 P   ifindex 3 aa:c1:ab:ff:b4:69 ethertype IPv4 (0x0800), length 72: 192.168.11.3.46828 > 192.168.11.2.179: Flags [.], ack 1, win 502, options [nop,nop,TS val 2681757175 ecr 1281669449], length 0
2026-07-16T11:07:41.12130208Z stdout F 11:07:40.833717 toswitch1 Out ifindex 84 aa:c1:ab:ff:b4:69 ethertype IPv4 (0x0800), length 72: 192.168.11.3.46828 > 192.168.11.2.179: Flags [.], ack 1, win 502, options [nop,nop,TS val 2681757175 ecr 1281669449], length 0
2026-07-16T11:07:41.121312719Z stdout F 11:07:40.833761 tap_toswitch2 P   ifindex 5 aa:c1:ab:c8:ba:6e ethertype IPv4 (0x0800), length 72: 192.168.12.3.33310 > 192.168.12.2.179: Flags [.], ack 1, win 502, options [nop,nop,TS val 1268629327 ecr 3958805793], length 0
2026-07-16T11:07:41.121315685Z stdout F 11:07:40.833764 toswitch2 Out ifindex 67 aa:c1:ab:c8:ba:6e ethertype IPv4 (0x0800), length 72: 192.168.12.3.33310 > 192.168.12.2.179: Flags [.], ack 1, win 502, options [nop,nop,TS val 1268629327 ecr 3958805793], length 0
2026-07-16T11:07:41.121375066Z stdout F 11:07:40.834077 main  Out ifindex 2 ethertype IPv4 (0x0800), length 190: 192.168.12.3.33310 > 192.168.12.2.179: Flags [P.], seq 1:119, ack 1, win 502, options [nop,nop,TS val 1268629327 ecr 3958805793], length 118: BGP
2026-07-16T11:07:41.121378652Z stdout F 11:07:40.834108 main  Out ifindex 2 ethertype IPv4 (0x0800), length 190: 192.168.11.3.46828 > 192.168.11.2.179: Flags [P.], seq 1:119, ack 1, win 502, options [nop,nop,TS val 2681757175 ecr 1281669449], length 118: BGP
2026-07-16T11:07:41.121381849Z stdout F 11:07:40.834145 tap_toswitch2 P   ifindex 5 aa:c1:ab:c8:ba:6e ethertype IPv4 (0x0800), length 190: 192.168.12.3.33310 > 192.168.12.2.179: Flags [P.], seq 1:119, ack 1, win 502, options [nop,nop,TS val 1268629327 ecr 3958805793], length 118: BGP
2026-07-16T11:07:41.121385135Z stdout F 11:07:40.834149 toswitch2 Out ifindex 67 aa:c1:ab:c8:ba:6e ethertype IPv4 (0x0800), length 190: 192.168.12.3.33310 > 192.168.12.2.179: Flags [P.], seq 1:119, ack 1, win 502, options [nop,nop,TS val 1268629327 ecr 3958805793], length 118: BGP
2026-07-16T11:07:41.12138816Z stdout F 11:07:40.834172 toswitch2 In  ifindex 67 aa:c1:ab:63:fb:8f ethertype IPv4 (0x0800), length 72: 192.168.12.2.179 > 192.168.12.3.33310: Flags [.], ack 119, win 442, options [nop,nop,TS val 3958805795 ecr 1268629327], length 0
2026-07-16T11:07:41.121391096Z stdout F 11:07:40.834175 tap_toswitch2 Out ifindex 5 aa:c1:ab:63:fb:8f ethertype IPv4 (0x0800), length 72: 192.168.12.2.179 > 192.168.12.3.33310: Flags [.], ack 119, win 442, options [nop,nop,TS val 3958805795 ecr 1268629327], length 0
2026-07-16T11:07:41.121393911Z stdout F 11:07:40.834190 toswitch2 In  ifindex 67 aa:c1:ab:63:fb:8f ethertype IPv4 (0x0800), length 210: 192.168.12.2.179 > 192.168.12.3.33310: Flags [P.], seq 1:139, ack 119, win 442, options [nop,nop,TS val 3958805795 ecr 1268629327], length 138: BGP
2026-07-16T11:07:41.121396726Z stdout F 11:07:40.834193 tap_toswitch2 Out ifindex 5 aa:c1:ab:63:fb:8f ethertype IPv4 (0x0800), length 210: 192.168.12.2.179 > 192.168.12.3.33310: Flags [P.], seq 1:139, ack 119, win 442, options [nop,nop,TS val 3958805795 ecr 1268629327], length 138: BGP
2026-07-16T11:07:41.121399742Z stdout F 11:07:40.834208 tap_toswitch1 P   ifindex 3 aa:c1:ab:ff:b4:69 ethertype IPv4 (0x0800), length 190: 192.168.11.3.46828 > 192.168.11.2.179: Flags [P.], seq 1:119, ack 1, win 502, options [nop,nop,TS val 2681757175 ecr 1281669449], length 118: BGP
2026-07-16T11:07:41.121426362Z stdout F 11:07:40.834211 toswitch1 Out ifindex 84 aa:c1:ab:ff:b4:69 ethertype IPv4 (0x0800), length 190: 192.168.11.3.46828 > 192.168.11.2.179: Flags [P.], seq 1:119, ack 1, win 502, options [nop,nop,TS val 2681757175 ecr 1281669449], length 118: BGP
2026-07-16T11:07:41.121704571Z stdout F 11:07:40.834246 toswitch1 In  ifindex 84 aa:c1:ab:c8:85:5f ethertype IPv4 (0x0800), length 72: 192.168.11.2.179 > 192.168.11.3.46828: Flags [.], ack 119, win 442, options [nop,nop,TS val 1281669451 ecr 2681757175], length 0
2026-07-16T11:07:41.121715301Z stdout F 11:07:40.834248 tap_toswitch1 Out ifindex 3 aa:c1:ab:c8:85:5f ethertype IPv4 (0x0800), length 72: 192.168.11.2.179 > 192.168.11.3.46828: Flags [.], ack 119, win 442, options [nop,nop,TS val 1281669451 ecr 2681757175], length 0
2026-07-16T11:07:41.121718627Z stdout F 11:07:40.834308 u_toswitch1 In  ifindex 4 aa:c1:ab:ff:b4:69 ethertype IPv4 (0x0800), length 72: 192.168.11.2.179 > 192.168.11.3.46828: Flags [.], ack 119, win 442, options [nop,nop,TS val 1281669451 ecr 2681757175], length 0
2026-07-16T11:07:41.121728857Z stdout F 11:07:40.834677 u_toswitch2 In  ifindex 6 aa:c1:ab:c8:ba:6e ethertype IPv4 (0x0800), length 72: 192.168.12.2.179 > 192.168.12.3.33310: Flags [.], ack 119, win 442, options [nop,nop,TS val 3958805795 ecr 1268629327], length 0
2026-07-16T11:07:41.121732684Z stdout F 11:07:40.834702 u_toswitch2 In  ifindex 6 aa:c1:ab:c8:ba:6e ethertype IPv4 (0x0800), length 210: 192.168.12.2.179 > 192.168.12.3.33310: Flags [P.], seq 1:139, ack 119, win 442, options [nop,nop,TS val 3958805795 ecr 1268629327], length 138: BGP
2026-07-16T11:07:41.121737032Z stdout F 11:07:40.834717 main  Out ifindex 2 ethertype IPv4 (0x0800), length 72: 192.168.12.3.33310 > 192.168.12.2.179: Flags [.], ack 139, win 501, options [nop,nop,TS val 1268629328 ecr 3958805795], length 0
2026-07-16T11:07:41.121740579Z stdout F 11:07:40.834809 tap_toswitch2 P   ifindex 5 aa:c1:ab:c8:ba:6e ethertype IPv4 (0x0800), length 72: 192.168.12.3.33310 > 192.168.12.2.179: Flags [.], ack 139, win 501, options [nop,nop,TS val 1268629328 ecr 3958805795], length 0
2026-07-16T11:07:41.121743725Z stdout F 11:07:40.834813 toswitch2 Out ifindex 67 aa:c1:ab:c8:ba:6e ethertype IPv4 (0x0800), length 72: 192.168.12.3.33310 > 192.168.12.2.179: Flags [.], ack 139, win 501, options [nop,nop,TS val 1268629328 ecr 3958805795], length 0
2026-07-16T11:07:41.121760736Z stdout F 11:07:40.834928 toswitch2 In  ifindex 67 aa:c1:ab:63:fb:8f ethertype IPv4 (0x0800), length 91: 192.168.12.2.179 > 192.168.12.3.33310: Flags [P.], seq 139:158, ack 119, win 442, options [nop,nop,TS val 3958805796 ecr 1268629328], length 19: BGP
2026-07-16T11:07:41.121763842Z stdout F 11:07:40.834931 tap_toswitch2 Out ifindex 5 aa:c1:ab:63:fb:8f ethertype IPv4 (0x0800), length 91: 192.168.12.2.179 > 192.168.12.3.33310: Flags [P.], seq 139:158, ack 119, win 442, options [nop,nop,TS val 3958805796 ecr 1268629328], length 19: BGP
2026-07-16T11:07:41.121766948Z stdout F 11:07:40.835071 toswitch1 In  ifindex 84 aa:c1:ab:c8:85:5f ethertype IPv4 (0x0800), length 210: 192.168.11.2.179 > 192.168.11.3.46828: Flags [P.], seq 1:139, ack 119, win 442, options [nop,nop,TS val 1281669452 ecr 2681757175], length 138: BGP
2026-07-16T11:07:41.121770003Z stdout F 11:07:40.835075 tap_toswitch1 Out ifindex 3 aa:c1:ab:c8:85:5f ethertype IPv4 (0x0800), length 210: 192.168.11.2.179 > 192.168.11.3.46828: Flags [P.], seq 1:139, ack 119, win 442, options [nop,nop,TS val 1281669452 ecr 2681757175], length 138: BGP
2026-07-16T11:07:41.121773089Z stdout F 11:07:40.835398 u_toswitch2 In  ifindex 6 aa:c1:ab:c8:ba:6e ethertype IPv4 (0x0800), length 91: 192.168.12.2.179 > 192.168.12.3.33310: Flags [P.], seq 139:158, ack 119, win 442, options [nop,nop,TS val 3958805796 ecr 1268629328], length 19: BGP
2026-07-16T11:07:41.121776105Z stdout F 11:07:40.835418 main  Out ifindex 2 ethertype IPv4 (0x0800), length 72: 192.168.12.3.33310 > 192.168.12.2.179: Flags [.], ack 158, win 501, options [nop,nop,TS val 1268629328 ecr 3958805796], length 0
2026-07-16T11:07:41.121779571Z stdout F 11:07:40.835473 tap_toswitch2 P   ifindex 5 aa:c1:ab:c8:ba:6e ethertype IPv4 (0x0800), length 72: 192.168.12.3.33310 > 192.168.12.2.179: Flags [.], ack 158, win 501, options [nop,nop,TS val 1268629328 ecr 3958805796], length 0
2026-07-16T11:07:41.121783018Z stdout F 11:07:40.835477 toswitch2 Out ifindex 67 aa:c1:ab:c8:ba:6e ethertype IPv4 (0x0800), length 72: 192.168.12.3.33310 > 192.168.12.2.179: Flags [.], ack 158, win 501, options [nop,nop,TS val 1268629328 ecr 3958805796], length 0
2026-07-16T11:07:41.121786554Z stdout F 11:07:40.835486 u_toswitch1 In  ifindex 4 aa:c1:ab:ff:b4:69 ethertype IPv4 (0x0800), length 210: 192.168.11.2.179 > 192.168.11.3.46828: Flags [P.], seq 1:139, ack 119, win 442, options [nop,nop,TS val 1281669452 ecr 2681757175], length 138: BGP
2026-07-16T11:07:41.121793077Z stdout F 11:07:40.835494 main  Out ifindex 2 ethertype IPv4 (0x0800), length 72: 192.168.11.3.46828 > 192.168.11.2.179: Flags [.], ack 139, win 501, options [nop,nop,TS val 2681757177 ecr 1281669452], length 0
2026-07-16T11:07:41.123631972Z stdout F 11:07:40.835528 tap_toswitch1 P   ifindex 3 aa:c1:ab:ff:b4:69 ethertype IPv4 (0x0800), length 72: 192.168.11.3.46828 > 192.168.11.2.179: Flags [.], ack 139, win 501, options [nop,nop,TS val 2681757177 ecr 1281669452], length 0
2026-07-16T11:07:41.123639225Z stdout F 11:07:40.835531 toswitch1 Out ifindex 84 aa:c1:ab:ff:b4:69 ethertype IPv4 (0x0800), length 72: 192.168.11.3.46828 > 192.168.11.2.179: Flags [.], ack 139, win 501, options [nop,nop,TS val 2681757177 ecr 1281669452], length 0
2026-07-16T11:07:41.123642732Z stdout F 11:07:40.835693 toswitch1 In  ifindex 84 aa:c1:ab:c8:85:5f ethertype IPv4 (0x0800), length 91: 192.168.11.2.179 > 192.168.11.3.46828: Flags [P.], seq 139:158, ack 119, win 442, options [nop,nop,TS val 1281669453 ecr 2681757177], length 19: BGP
2026-07-16T11:07:41.123646338Z stdout F 11:07:40.835696 tap_toswitch1 Out ifindex 3 aa:c1:ab:c8:85:5f ethertype IPv4 (0x0800), length 91: 192.168.11.2.179 > 192.168.11.3.46828: Flags [P.], seq 139:158, ack 119, win 442, options [nop,nop,TS val 1281669453 ecr 2681757177], length 19: BGP
2026-07-16T11:07:41.123649955Z stdout F 11:07:40.835870 u_toswitch1 In  ifindex 4 aa:c1:ab:ff:b4:69 ethertype IPv4 (0x0800), length 91: 192.168.11.2.179 > 192.168.11.3.46828: Flags [P.], seq 139:158, ack 119, win 442, options [nop,nop,TS val 1281669453 ecr 2681757177], length 19: BGP
2026-07-16T11:07:41.123653893Z stdout F 11:07:40.835888 main  Out ifindex 2 ethertype IPv4 (0x0800), length 72: 192.168.11.3.46828 > 192.168.11.2.179: Flags [.], ack 158, win 501, options [nop,nop,TS val 2681757177 ecr 1281669453], length 0
2026-07-16T11:07:41.123657279Z stdout F 11:07:40.836014 tap_toswitch1 P   ifindex 3 aa:c1:ab:ff:b4:69 ethertype IPv4 (0x0800), length 72: 192.168.11.3.46828 > 192.168.11.2.179: Flags [.], ack 158, win 501, options [nop,nop,TS val 2681757177 ecr 1281669453], length 0
2026-07-16T11:07:41.124087402Z stdout F 11:07:40.836018 toswitch1 Out ifindex 84 aa:c1:ab:ff:b4:69 ethertype IPv4 (0x0800), length 72: 192.168.11.3.46828 > 192.168.11.2.179: Flags [.], ack 158, win 501, options [nop,nop,TS val 2681757177 ecr 1281669453], length 0
2026-07-16T11:07:41.124094496Z stdout F 11:07:40.836255 main  Out ifindex 2 ethertype IPv4 (0x0800), length 91: 192.168.12.3.33310 > 192.168.12.2.179: Flags [P.], seq 119:138, ack 158, win 501, options [nop,nop,TS val 1268629329 ecr 3958805796], length 19: BGP
2026-07-16T11:07:41.124098383Z stdout F 11:07:40.836315 tap_toswitch2 P   ifindex 5 aa:c1:ab:c8:ba:6e ethertype IPv4 (0x0800), length 91: 192.168.12.3.33310 > 192.168.12.2.179: Flags [P.], seq 119:138, ack 158, win 501, options [nop,nop,TS val 1268629329 ecr 3958805796], length 19: BGP
2026-07-16T11:07:41.124101569Z stdout F 11:07:40.836319 toswitch2 Out ifindex 67 aa:c1:ab:c8:ba:6e ethertype IPv4 (0x0800), length 91: 192.168.12.3.33310 > 192.168.12.2.179: Flags [P.], seq 119:138, ack 158, win 501, options [nop,nop,TS val 1268629329 ecr 3958805796], length 19: BGP
2026-07-16T11:07:41.124104664Z stdout F 11:07:40.836899 main  Out ifindex 2 ethertype IPv4 (0x0800), length 91: 192.168.11.3.46828 > 192.168.11.2.179: Flags [P.], seq 119:138, ack 158, win 501, options [nop,nop,TS val 2681757178 ecr 1281669453], length 19: BGP
2026-07-16T11:07:41.124110165Z stdout F 11:07:40.837006 tap_toswitch1 P   ifindex 3 aa:c1:ab:ff:b4:69 ethertype IPv4 (0x0800), length 91: 192.168.11.3.46828 > 192.168.11.2.179: Flags [P.], seq 119:138, ack 158, win 501, options [nop,nop,TS val 2681757178 ecr 1281669453], length 19: BGP
2026-07-16T11:07:41.124113441Z stdout F 11:07:40.837010 toswitch1 Out ifindex 84 aa:c1:ab:ff:b4:69 ethertype IPv4 (0x0800), length 91: 192.168.11.3.46828 > 192.168.11.2.179: Flags [P.], seq 119:138, ack 158, win 501, options [nop,nop,TS val 2681757178 ecr 1281669453], length 19: BGP
2026-07-16T11:07:41.124116898Z stdout F 11:07:40.847236 toswitch2 In  ifindex 67 aa:c1:ab:63:fb:8f ethertype IPv4 (0x0800), length 157: 192.168.12.2.179 > 192.168.12.3.33310: Flags [P.], seq 158:243, ack 138, win 442, options [nop,nop,TS val 3958805808 ecr 1268629329], length 85: BGP
2026-07-16T11:07:41.12412923Z stdout F 11:07:40.847240 tap_toswitch2 Out ifindex 5 aa:c1:ab:63:fb:8f ethertype IPv4 (0x0800), length 157: 192.168.12.2.179 > 192.168.12.3.33310: Flags [P.], seq 158:243, ack 138, win 442, options [nop,nop,TS val 3958805808 ecr 1268629329], length 85: BGP
2026-07-16T11:07:41.124132797Z stdout F 11:07:40.847403 u_toswitch2 In  ifindex 6 aa:c1:ab:c8:ba:6e ethertype IPv4 (0x0800), length 157: 192.168.12.2.179 > 192.168.12.3.33310: Flags [P.], seq 158:243, ack 138, win 442, options [nop,nop,TS val 3958805808 ecr 1268629329], length 85: BGP
2026-07-16T11:07:42.144864304Z stdout F 11:07:40.877608 toswitch1 In  ifindex 84 aa:c1:ab:c8:85:5f ethertype IPv4 (0x0800), length 72: 192.168.11.2.179 > 192.168.11.3.46828: Flags [.], ack 138, win 442, options [nop,nop,TS val 1281669495 ecr 2681757178], length 0
2026-07-16T11:07:42.144881426Z stdout F 11:07:40.877614 tap_toswitch1 Out ifindex 3 aa:c1:ab:c8:85:5f ethertype IPv4 (0x0800), length 72: 192.168.11.2.179 > 192.168.11.3.46828: Flags [.], ack 138, win 442, options [nop,nop,TS val 1281669495 ecr 2681757178], length 0
2026-07-16T11:07:42.144885554Z stdout F 11:07:40.877797 u_toswitch1 In  ifindex 4 aa:c1:ab:ff:b4:69 ethertype IPv4 (0x0800), length 72: 192.168.11.2.179 > 192.168.11.3.46828: Flags [.], ack 138, win 442, options [nop,nop,TS val 1281669495 ecr 2681757178], length 0
2026-07-16T11:07:42.144889141Z stdout F 11:07:40.887479 main  Out ifindex 2 ethertype IPv4 (0x0800), length 72: 192.168.12.3.33310 > 192.168.12.2.179: Flags [.], ack 243, win 501, options [nop,nop,TS val 1268629381 ecr 3958805808], length 0
2026-07-16T11:07:42.144892377Z stdout F 11:07:40.887972 tap_toswitch2 P   ifindex 5 aa:c1:ab:c8:ba:6e ethertype IPv4 (0x0800), length 72: 192.168.12.3.33310 > 192.168.12.2.179: Flags [.], ack 243, win 501, options [nop,nop,TS val 1268629381 ecr 3958805808], length 0
2026-07-16T11:07:42.144895543Z stdout F 11:07:40.887980 toswitch2 Out ifindex 67 aa:c1:ab:c8:ba:6e ethertype IPv4 (0x0800), length 72: 192.168.12.3.33310 > 192.168.12.2.179: Flags [.], ack 243, win 501, options [nop,nop,TS val 1268629381 ecr 3958805808], length 0
2026-07-16T11:07:42.144898899Z stdout F 11:07:41.937502 main  Out ifindex 2 ethertype IPv4 (0x0800), length 217: 192.168.11.3.46828 > 192.168.11.2.179: Flags [P.], seq 138:283, ack 158, win 501, options [nop,nop,TS val 2681758279 ecr 1281669495], length 145: BGP
2026-07-16T11:07:42.144901955Z stdout F 11:07:41.937547 main  Out ifindex 2 ethertype IPv4 (0x0800), length 217: 192.168.12.3.33310 > 192.168.12.2.179: Flags [P.], seq 138:283, ack 243, win 501, options [nop,nop,TS val 1268630431 ecr 3958805808], length 145: BGP
2026-07-16T11:07:42.144905581Z stdout F 11:07:41.937656 tap_toswitch1 P   ifindex 3 aa:c1:ab:ff:b4:69 ethertype IPv4 (0x0800), length 217: 192.168.11.3.46828 > 192.168.11.2.179: Flags [P.], seq 138:283, ack 158, win 501, options [nop,nop,TS val 2681758279 ecr 1281669495], length 145: BGP
2026-07-16T11:07:42.144908838Z stdout F 11:07:41.937665 toswitch1 Out ifindex 84 aa:c1:ab:ff:b4:69 ethertype IPv4 (0x0800), length 217: 192.168.11.3.46828 > 192.168.11.2.179: Flags [P.], seq 138:283, ack 158, win 501, options [nop,nop,TS val 2681758279 ecr 1281669495], length 145: BGP
2026-07-16T11:07:42.144915841Z stdout F 11:07:41.937704 toswitch1 In  ifindex 84 aa:c1:ab:c8:85:5f ethertype IPv4 (0x0800), length 72: 192.168.11.2.179 > 192.168.11.3.46828: Flags [.], ack 283, win 441, options [nop,nop,TS val 1281670555 ecr 2681758279], length 0
2026-07-16T11:07:42.144919347Z stdout F 11:07:41.937710 tap_toswitch1 Out ifindex 3 aa:c1:ab:c8:85:5f ethertype IPv4 (0x0800), length 72: 192.168.11.2.179 > 192.168.11.3.46828: Flags [.], ack 283, win 441, options [nop,nop,TS val 1281670555 ecr 2681758279], length 0
2026-07-16T11:07:42.144922423Z stdout F 11:07:41.937742 tap_toswitch2 P   ifindex 5 aa:c1:ab:c8:ba:6e ethertype IPv4 (0x0800), length 217: 192.168.12.3.33310 > 192.168.12.2.179: Flags [P.], seq 138:283, ack 243, win 501, options [nop,nop,TS val 1268630431 ecr 3958805808], length 145: BGP
2026-07-16T11:07:42.144935818Z stdout F 11:07:41.937748 toswitch2 Out ifindex 67 aa:c1:ab:c8:ba:6e ethertype IPv4 (0x0800), length 217: 192.168.12.3.33310 > 192.168.12.2.179: Flags [P.], seq 138:283, ack 243, win 501, options [nop,nop,TS val 1268630431 ecr 3958805808], length 145: BGP
2026-07-16T11:07:42.144957208Z stdout F 11:07:41.938352 u_toswitch1 In  ifindex 4 aa:c1:ab:ff:b4:69 ethertype IPv4 (0x0800), length 72: 192.168.11.2.179 > 192.168.11.3.46828: Flags [.], ack 283, win 441, options [nop,nop,TS val 1281670555 ecr 2681758279], length 0
2026-07-16T11:07:42.144961416Z stdout F 11:07:41.978508 toswitch2 In  ifindex 67 aa:c1:ab:63:fb:8f ethertype IPv4 (0x0800), length 72: 192.168.12.2.179 > 192.168.12.3.33310: Flags [.], ack 283, win 441, options [nop,nop,TS val 3958806940 ecr 1268630431], length 0
2026-07-16T11:07:42.144964622Z stdout F 11:07:41.978515 tap_toswitch2 Out ifindex 5 aa:c1:ab:63:fb:8f ethertype IPv4 (0x0800), length 72: 192.168.12.2.179 > 192.168.12.3.33310: Flags [.], ack 283, win 441, options [nop,nop,TS val 3958806940 ecr 1268630431], length 0
2026-07-16T11:07:42.144971615Z stdout F 11:07:41.979344 u_toswitch2 In  ifindex 6 aa:c1:ab:c8:ba:6e ethertype IPv4 (0x0800), length 72: 192.168.12.2.179 > 192.168.12.3.33310: Flags [.], ack 283, win 441, options [nop,nop,TS val 3958806940 ecr 1268630431], length 0
2026-07-16T11:07:45.217077601Z stdout F 11:07:41.989043 toswitch2 In  ifindex 67 aa:c1:ab:63:fb:8f ethertype IPv4 (0x0800), length 125: 192.168.12.2.179 > 192.168.12.3.33310: Flags [P.], seq 243:296, ack 283, win 441, options [nop,nop,TS val 3958806950 ecr 1268630431], length 53: BGP
2026-07-16T11:07:45.217096236Z stdout F 11:07:41.989048 tap_toswitch2 Out ifindex 5 aa:c1:ab:63:fb:8f ethertype IPv4 (0x0800), length 125: 192.168.12.2.179 > 192.168.12.3.33310: Flags [P.], seq 243:296, ack 283, win 441, options [nop,nop,TS val 3958806950 ecr 1268630431], length 53: BGP
2026-07-16T11:07:45.217100194Z stdout F 11:07:41.989280 u_toswitch2 In  ifindex 6 aa:c1:ab:c8:ba:6e ethertype IPv4 (0x0800), length 125: 192.168.12.2.179 > 192.168.12.3.33310: Flags [P.], seq 243:296, ack 283, win 441, options [nop,nop,TS val 3958806950 ecr 1268630431], length 53: BGP
2026-07-16T11:07:45.217105103Z stdout F 11:07:41.989302 main  Out ifindex 2 ethertype IPv4 (0x0800), length 72: 192.168.12.3.33310 > 192.168.12.2.179: Flags [.], ack 296, win 501, options [nop,nop,TS val 1268630482 ecr 3958806950], length 0
2026-07-16T11:07:45.217109491Z stdout F 11:07:41.989385 tap_toswitch2 P   ifindex 5 aa:c1:ab:c8:ba:6e ethertype IPv4 (0x0800), length 72: 192.168.12.3.33310 > 192.168.12.2.179: Flags [.], ack 296, win 501, options [nop,nop,TS val 1268630482 ecr 3958806950], length 0
2026-07-16T11:07:45.217113669Z stdout F 11:07:41.989391 toswitch2 Out ifindex 67 aa:c1:ab:c8:ba:6e ethertype IPv4 (0x0800), length 72: 192.168.12.3.33310 > 192.168.12.2.179: Flags [.], ack 296, win 501, options [nop,nop,TS val 1268630482 ecr 3958806950], length 0
2026-07-16T11:07:45.217116775Z stdout F 11:07:42.038975 toswitch1 In  ifindex 84 aa:c1:ab:c8:85:5f ethertype IPv4 (0x0800), length 210: 192.168.11.2.179 > 192.168.11.3.46828: Flags [P.], seq 158:296, ack 283, win 441, options [nop,nop,TS val 1281670656 ecr 2681758279], length 138: BGP
2026-07-16T11:07:45.2171197Z stdout F 11:07:42.038980 tap_toswitch1 Out ifindex 3 aa:c1:ab:c8:85:5f ethertype IPv4 (0x0800), length 210: 192.168.11.2.179 > 192.168.11.3.46828: Flags [P.], seq 158:296, ack 283, win 441, options [nop,nop,TS val 1281670656 ecr 2681758279], length 138: BGP
2026-07-16T11:07:45.217122495Z stdout F 11:07:42.039507 u_toswitch1 In  ifindex 4 aa:c1:ab:ff:b4:69 ethertype IPv4 (0x0800), length 210: 192.168.11.2.179 > 192.168.11.3.46828: Flags [P.], seq 158:296, ack 283, win 441, options [nop,nop,TS val 1281670656 ecr 2681758279], length 138: BGP
2026-07-16T11:07:45.217125441Z stdout F 11:07:42.080483 main  Out ifindex 2 ethertype IPv4 (0x0800), length 72: 192.168.11.3.46828 > 192.168.11.2.179: Flags [.], ack 296, win 501, options [nop,nop,TS val 2681758422 ecr 1281670656], length 0
2026-07-16T11:07:45.217139127Z stdout F 11:07:42.080659 tap_toswitch1 P   ifindex 3 aa:c1:ab:ff:b4:69 ethertype IPv4 (0x0800), length 72: 192.168.11.3.46828 > 192.168.11.2.179: Flags [.], ack 296, win 501, options [nop,nop,TS val 2681758422 ecr 1281670656], length 0
2026-07-16T11:07:45.217142212Z stdout F 11:07:42.080665 toswitch1 Out ifindex 84 aa:c1:ab:ff:b4:69 ethertype IPv4 (0x0800), length 72: 192.168.11.3.46828 > 192.168.11.2.179: Flags [.], ack 296, win 501, options [nop,nop,TS val 2681758422 ecr 1281670656], length 0
2026-07-16T11:07:45.217145679Z stdout F 11:07:44.800445 toswitch2 In  ifindex 67 aa:c1:ab:63:fb:8f ethertype IPv4 (0x0800), length 125: 192.168.12.2.179 > 192.168.12.3.33310: Flags [P.], seq 296:349, ack 283, win 441, options [nop,nop,TS val 3958809761 ecr 1268630482], length 53: BGP
2026-07-16T11:07:45.217149456Z stdout F 11:07:44.800473 tap_toswitch2 Out ifindex 5 aa:c1:ab:63:fb:8f ethertype IPv4 (0x0800), length 125: 192.168.12.2.179 > 192.168.12.3.33310: Flags [P.], seq 296:349, ack 283, win 441, options [nop,nop,TS val 3958809761 ecr 1268630482], length 53: BGP
2026-07-16T11:07:45.217152752Z stdout F 11:07:44.800981 u_toswitch2 In  ifindex 6 aa:c1:ab:c8:ba:6e ethertype IPv4 (0x0800), length 125: 192.168.12.2.179 > 192.168.12.3.33310: Flags [P.], seq 296:349, ack 283, win 441, options [nop,nop,TS val 3958809761 ecr 1268630482], length 53: BGP
2026-07-16T11:07:45.217156218Z stdout F 11:07:44.801015 main  Out ifindex 2 ethertype IPv4 (0x0800), length 72: 192.168.12.3.33310 > 192.168.12.2.179: Flags [.], ack 349, win 501, options [nop,nop,TS val 1268633294 ecr 3958809761], length 0
2026-07-16T11:07:45.217159835Z stdout F 11:07:44.801100 tap_toswitch2 P   ifindex 5 aa:c1:ab:c8:ba:6e ethertype IPv4 (0x0800), length 72: 192.168.12.3.33310 > 192.168.12.2.179: Flags [.], ack 349, win 501, options [nop,nop,TS val 1268633294 ecr 3958809761], length 0
2026-07-16T11:07:45.217167189Z stdout F 11:07:44.801107 toswitch2 Out ifindex 67 aa:c1:ab:c8:ba:6e ethertype IPv4 (0x0800), length 72: 192.168.12.3.33310 > 192.168.12.2.179: Flags [.], ack 349, win 501, options [nop,nop,TS val 1268633294 ecr 3958809761], length 0
2026-07-16T11:07:45.217177268Z stdout F 11:07:44.801695 toswitch1 In  ifindex 84 aa:c1:ab:c8:85:5f ethertype IPv4 (0x0800), length 125: 192.168.11.2.179 > 192.168.11.3.46828: Flags [P.], seq 296:349, ack 283, win 441, options [nop,nop,TS val 1281673419 ecr 2681758422], length 53: BGP
2026-07-16T11:07:45.217180484Z stdout F 11:07:44.801700 tap_toswitch1 Out ifindex 3 aa:c1:ab:c8:85:5f ethertype IPv4 (0x0800), length 125: 192.168.11.2.179 > 192.168.11.3.46828: Flags [P.], seq 296:349, ack 283, win 441, options [nop,nop,TS val 1281673419 ecr 2681758422], length 53: BGP
2026-07-16T11:07:45.217183519Z stdout F 11:07:44.802569 u_toswitch1 In  ifindex 4 aa:c1:ab:ff:b4:69 ethertype IPv4 (0x0800), length 125: 192.168.11.2.179 > 192.168.11.3.46828: Flags [P.], seq 296:349, ack 283, win 441, options [nop,nop,TS val 1281673419 ecr 2681758422], length 53: BGP
