2026-07-16T11:05:54.34332883Z stderr F + yum install -y tcpdump
2026-07-16T11:05:58.385616546Z stdout F CentOS Stream 10 - BaseOS                       1.9 MB/s | 7.0 MB     00:03    
2026-07-16T11:06:02.42939571Z stdout F CentOS Stream 10 - AppStream                    1.6 MB/s | 3.6 MB     00:02    
2026-07-16T11:06:04.792616145Z stdout F CentOS Stream 10 - Extras packages              6.2 kB/s |  10 kB     00:01    
2026-07-16T11:06:05.357911157Z stdout F Dependencies resolved.
2026-07-16T11:06:05.358835614Z stdout F ================================================================================
2026-07-16T11:06:05.358847126Z stdout F  Package          Architecture Version                    Repository       Size
2026-07-16T11:06:05.358851053Z stdout F ================================================================================
2026-07-16T11:06:05.358854529Z stdout F Installing:
2026-07-16T11:06:05.358857886Z stdout F  tcpdump          x86_64       14:4.99.4-10.el10          appstream       503 k
2026-07-16T11:06:05.358861613Z stdout F Installing dependencies:
2026-07-16T11:06:05.358865019Z stdout F  libibverbs       x86_64       62.0-2.el10                baseos          484 k
2026-07-16T11:06:05.358868335Z stdout F  libnl3           x86_64       3.11.0-1.el10              baseos          361 k
2026-07-16T11:06:05.358871732Z stdout F  libpcap          x86_64       14:1.10.4-7.el10           baseos          175 k
2026-07-16T11:06:05.358874918Z stdout F 
2026-07-16T11:06:05.358878444Z stdout F Transaction Summary
2026-07-16T11:06:05.358881871Z stdout F ================================================================================
2026-07-16T11:06:05.358885177Z stdout F Install  4 Packages
2026-07-16T11:06:05.358888323Z stdout F 
2026-07-16T11:06:05.35926724Z stdout F Total download size: 1.5 M
2026-07-16T11:06:05.35932566Z stdout F Installed size: 3.9 M
2026-07-16T11:06:05.359511174Z stdout F Downloading Packages:
2026-07-16T11:06:06.662732817Z stdout F (1/4): libpcap-1.10.4-7.el10.x86_64.rpm         304 kB/s | 175 kB     00:00    
2026-07-16T11:06:07.172185996Z stdout F (2/4): tcpdump-4.99.4-10.el10.x86_64.rpm        990 kB/s | 503 kB     00:00    
2026-07-16T11:06:07.753862155Z stdout F (3/4): libibverbs-62.0-2.el10.x86_64.rpm        290 kB/s | 484 kB     00:01    
2026-07-16T11:06:07.771989472Z stdout F (4/4): libnl3-3.11.0-1.el10.x86_64.rpm          215 kB/s | 361 kB     00:01    
2026-07-16T11:06:07.776018704Z stdout F --------------------------------------------------------------------------------
2026-07-16T11:06:07.776100166Z stdout F Total                                           630 kB/s | 1.5 MB     00:02     
2026-07-16T11:06:07.791002275Z stdout F CentOS Stream 10 - BaseOS                       1.6 MB/s | 1.6 kB     00:00    
2026-07-16T11:06:07.797555898Z stderr F Importing GPG key 0x8483C65D:
2026-07-16T11:06:07.797572158Z stderr F  Userid     : "CentOS (CentOS Official Signing Key) <security@centos.org>"
2026-07-16T11:06:07.797578019Z stderr F  Fingerprint: 99DB 70FA E1D7 CE22 7FB6 4882 05B5 55B3 8483 C65D
2026-07-16T11:06:07.797582878Z stderr F  From       : /etc/pki/rpm-gpg/RPM-GPG-KEY-centosofficial-SHA256
2026-07-16T11:06:07.834321648Z stdout F Key imported successfully
2026-07-16T11:06:07.905589829Z stdout F Running transaction check
2026-07-16T11:06:07.914438309Z stdout F Transaction check succeeded.
2026-07-16T11:06:07.91466393Z stdout F Running transaction test
2026-07-16T11:06:07.988735817Z stdout F Transaction test succeeded.
2026-07-16T11:06:07.988791952Z stdout F Running transaction
2026-07-16T11:06:08.085440846Z stdout F   Preparing        :                                                        1/1 
2026-07-16T11:06:08.12453807Z stdout F   Installing       : libnl3-3.11.0-1.el10.x86_64                            1/4 
2026-07-16T11:06:08.138219698Z stdout F   Installing       : libibverbs-62.0-2.el10.x86_64                          2/4 
2026-07-16T11:06:08.141586528Z stdout F   Installing       : libpcap-14:1.10.4-7.el10.x86_64                        3/4 
2026-07-16T11:06:08.206305245Z stdout F   Running scriptlet: tcpdump-14:4.99.4-10.el10.x86_64                       4/4 
2026-07-16T11:06:08.20633483Z stdout F useradd: Warning: missing or non-executable shell '/usr/sbin/nologin'
2026-07-16T11:06:08.206338687Z stdout F 
2026-07-16T11:06:08.24710357Z stdout F   Installing       : tcpdump-14:4.99.4-10.el10.x86_64                       4/4 
2026-07-16T11:06:08.405583916Z stdout F   Running scriptlet: tcpdump-14:4.99.4-10.el10.x86_64                       4/4 
2026-07-16T11:06:08.405606337Z stdout F 
2026-07-16T11:06:08.405612389Z stdout F Installed:
2026-07-16T11:06:08.405617719Z stdout F   libibverbs-62.0-2.el10.x86_64          libnl3-3.11.0-1.el10.x86_64            
2026-07-16T11:06:08.405622908Z stdout F   libpcap-14:1.10.4-7.el10.x86_64        tcpdump-14:4.99.4-10.el10.x86_64       
2026-07-16T11:06:08.405627507Z stdout F 
2026-07-16T11:06:08.405633107Z stdout F Complete!
2026-07-16T11:06:08.475447021Z stderr F + nsenter --net=/var/run/netns/perouter tcpdump -e -nn -i any tcp port 179 or udp port 4789 or tcp port 8090
2026-07-16T11:06:08.495331768Z stderr F tcpdump: data link type LINUX_SLL2
2026-07-16T11:06:08.49535459Z stderr F dropped privs to tcpdump
2026-07-16T11:06:08.495361173Z stderr F tcpdump: verbose output suppressed, use -v[v]... for full protocol decode
2026-07-16T11:06:08.495367254Z stderr F listening on any, link-type LINUX_SLL2 (Linux cooked v2), snapshot length 262144 bytes
2026-07-16T11:07:39.649670195Z stdout F 11:07:37.790058 toswitch1 In  ifindex 86 aa:c1:ab:c8:85:5f ethertype IPv4 (0x0800), length 80: 192.168.11.2.45094 > 192.168.11.4.179: Flags [S], seq 3563219108, win 56760, options [mss 9460,sackOK,TS val 3422779137 ecr 0,nop,wscale 7], length 0
2026-07-16T11:07:39.64969412Z stdout F 11:07:37.790061 tap_toswitch1 Out ifindex 3 aa:c1:ab:c8:85:5f ethertype IPv4 (0x0800), length 80: 192.168.11.2.45094 > 192.168.11.4.179: Flags [S], seq 3563219108, win 56760, options [mss 9460,sackOK,TS val 3422779137 ecr 0,nop,wscale 7], length 0
2026-07-16T11:07:39.649715279Z stdout F 11:07:37.790182 u_toswitch1 In  ifindex 4 aa:c1:ab:4f:4c:34 ethertype IPv4 (0x0800), length 80: 192.168.11.2.45094 > 192.168.11.4.179: Flags [S], seq 3563219108, win 56760, options [mss 9460,sackOK,TS val 3422779137 ecr 0,nop,wscale 7], length 0
2026-07-16T11:07:39.649721481Z stdout F 11:07:37.790216 main  Out ifindex 2 ethertype IPv4 (0x0800), length 60: 192.168.11.4.179 > 192.168.11.2.45094: Flags [R.], seq 0, ack 3563219109, win 0, length 0
2026-07-16T11:07:39.649727141Z stdout F 11:07:37.791497 tap_toswitch1 P   ifindex 3 aa:c1:ab:4f:4c:34 ethertype IPv4 (0x0800), length 60: 192.168.11.4.179 > 192.168.11.2.45094: Flags [R.], seq 0, ack 1, win 0, length 0
2026-07-16T11:07:39.649732431Z stdout F 11:07:37.791501 toswitch1 Out ifindex 86 aa:c1:ab:4f:4c:34 ethertype IPv4 (0x0800), length 60: 192.168.11.4.179 > 192.168.11.2.45094: Flags [R.], seq 0, ack 1, win 0, length 0
2026-07-16T11:07:39.649737471Z stdout F 11:07:38.802054 toswitch2 In  ifindex 69 aa:c1:ab:63:fb:8f ethertype IPv4 (0x0800), length 80: 192.168.12.2.56764 > 192.168.12.4.179: Flags [S], seq 1145939315, win 56760, options [mss 9460,sackOK,TS val 2550236055 ecr 0,nop,wscale 7], length 0
2026-07-16T11:07:39.64974269Z stdout F 11:07:38.802057 tap_toswitch2 Out ifindex 7 aa:c1:ab:63:fb:8f ethertype IPv4 (0x0800), length 80: 192.168.12.2.56764 > 192.168.12.4.179: Flags [S], seq 1145939315, win 56760, options [mss 9460,sackOK,TS val 2550236055 ecr 0,nop,wscale 7], length 0
2026-07-16T11:07:39.649748181Z stdout F 11:07:38.803018 u_toswitch2 In  ifindex 8 aa:c1:ab:38:76:54 ethertype IPv4 (0x0800), length 80: 192.168.12.2.56764 > 192.168.12.4.179: Flags [S], seq 1145939315, win 56760, options [mss 9460,sackOK,TS val 2550236055 ecr 0,nop,wscale 7], length 0
2026-07-16T11:07:39.649753531Z stdout F 11:07:38.803050 main  Out ifindex 2 ethertype IPv4 (0x0800), length 80: 192.168.12.4.179 > 192.168.12.2.56764: Flags [S.], seq 339488257, ack 1145939316, win 65160, options [mss 1460,sackOK,TS val 519297450 ecr 2550236055,nop,wscale 7], length 0
2026-07-16T11:07:39.649759412Z stdout F 11:07:38.803499 tap_toswitch2 P   ifindex 7 aa:c1:ab:38:76:54 ethertype IPv4 (0x0800), length 80: 192.168.12.4.179 > 192.168.12.2.56764: Flags [S.], seq 339488257, ack 1145939316, win 65160, options [mss 1460,sackOK,TS val 519297450 ecr 2550236055,nop,wscale 7], length 0
2026-07-16T11:07:39.649777005Z stdout F 11:07:38.803502 toswitch2 Out ifindex 69 aa:c1:ab:38:76:54 ethertype IPv4 (0x0800), length 80: 192.168.12.4.179 > 192.168.12.2.56764: Flags [S.], seq 339488257, ack 1145939316, win 65160, options [mss 1460,sackOK,TS val 519297450 ecr 2550236055,nop,wscale 7], length 0
2026-07-16T11:07:39.649780712Z stdout F 11:07:38.803547 toswitch2 In  ifindex 69 aa:c1:ab:63:fb:8f ethertype IPv4 (0x0800), length 72: 192.168.12.2.56764 > 192.168.12.4.179: Flags [.], ack 1, win 444, options [nop,nop,TS val 2550236057 ecr 519297450], length 0
2026-07-16T11:07:39.649784298Z stdout F 11:07:38.803550 tap_toswitch2 Out ifindex 7 aa:c1:ab:63:fb:8f ethertype IPv4 (0x0800), length 72: 192.168.12.2.56764 > 192.168.12.4.179: Flags [.], ack 1, win 444, options [nop,nop,TS val 2550236057 ecr 519297450], length 0
2026-07-16T11:07:39.649787855Z stdout F 11:07:38.803685 toswitch2 In  ifindex 69 aa:c1:ab:63:fb:8f ethertype IPv4 (0x0800), length 210: 192.168.12.2.56764 > 192.168.12.4.179: Flags [P.], seq 1:139, ack 1, win 444, options [nop,nop,TS val 2550236057 ecr 519297450], length 138: BGP
2026-07-16T11:07:39.649791101Z stdout F 11:07:38.803688 tap_toswitch2 Out ifindex 7 aa:c1:ab:63:fb:8f ethertype IPv4 (0x0800), length 210: 192.168.12.2.56764 > 192.168.12.4.179: Flags [P.], seq 1:139, ack 1, win 444, options [nop,nop,TS val 2550236057 ecr 519297450], length 138: BGP
2026-07-16T11:07:39.649794287Z stdout F 11:07:38.804744 u_toswitch2 In  ifindex 8 aa:c1:ab:38:76:54 ethertype IPv4 (0x0800), length 72: 192.168.12.2.56764 > 192.168.12.4.179: Flags [.], ack 1, win 444, options [nop,nop,TS val 2550236057 ecr 519297450], length 0
2026-07-16T11:07:43.745905866Z stdout F 11:07:38.804789 u_toswitch2 In  ifindex 8 aa:c1:ab:38:76:54 ethertype IPv4 (0x0800), length 210: 192.168.12.2.56764 > 192.168.12.4.179: Flags [P.], seq 1:139, ack 1, win 444, options [nop,nop,TS val 2550236057 ecr 519297450], length 138: BGP
2026-07-16T11:07:43.74592404Z stdout F 11:07:38.804798 main  Out ifindex 2 ethertype IPv4 (0x0800), length 72: 192.168.12.4.179 > 192.168.12.2.56764: Flags [.], ack 139, win 508, options [nop,nop,TS val 519297452 ecr 2550236057], length 0
2026-07-16T11:07:43.745928318Z stdout F 11:07:38.804908 tap_toswitch2 P   ifindex 7 aa:c1:ab:38:76:54 ethertype IPv4 (0x0800), length 72: 192.168.12.4.179 > 192.168.12.2.56764: Flags [.], ack 139, win 508, options [nop,nop,TS val 519297452 ecr 2550236057], length 0
2026-07-16T11:07:43.745932195Z stdout F 11:07:38.804912 toswitch2 Out ifindex 69 aa:c1:ab:38:76:54 ethertype IPv4 (0x0800), length 72: 192.168.12.4.179 > 192.168.12.2.56764: Flags [.], ack 139, win 508, options [nop,nop,TS val 519297452 ecr 2550236057], length 0
2026-07-16T11:07:43.745935401Z stdout F 11:07:38.805583 main  Out ifindex 2 ethertype IPv4 (0x0800), length 72: 192.168.12.4.179 > 192.168.12.2.56764: Flags [R.], seq 1, ack 139, win 508, options [nop,nop,TS val 519297453 ecr 2550236057], length 0
2026-07-16T11:07:43.745938778Z stdout F 11:07:38.805818 tap_toswitch2 P   ifindex 7 aa:c1:ab:38:76:54 ethertype IPv4 (0x0800), length 72: 192.168.12.4.179 > 192.168.12.2.56764: Flags [R.], seq 1, ack 139, win 508, options [nop,nop,TS val 519297453 ecr 2550236057], length 0
2026-07-16T11:07:43.745942164Z stdout F 11:07:38.805822 toswitch2 Out ifindex 69 aa:c1:ab:38:76:54 ethertype IPv4 (0x0800), length 72: 192.168.12.4.179 > 192.168.12.2.56764: Flags [R.], seq 1, ack 139, win 508, options [nop,nop,TS val 519297453 ecr 2550236057], length 0
2026-07-16T11:07:43.74594537Z stdout F 11:07:42.793209 toswitch1 In  ifindex 86 aa:c1:ab:c8:85:5f ethertype IPv4 (0x0800), length 80: 192.168.11.2.60274 > 192.168.11.4.179: Flags [S], seq 2222172090, win 56760, options [mss 9460,sackOK,TS val 3422784140 ecr 0,nop,wscale 7], length 0
2026-07-16T11:07:43.745948797Z stdout F 11:07:42.793220 tap_toswitch1 Out ifindex 3 aa:c1:ab:c8:85:5f ethertype IPv4 (0x0800), length 80: 192.168.11.2.60274 > 192.168.11.4.179: Flags [S], seq 2222172090, win 56760, options [mss 9460,sackOK,TS val 3422784140 ecr 0,nop,wscale 7], length 0
2026-07-16T11:07:43.74596689Z stdout F 11:07:42.793501 u_toswitch1 In  ifindex 4 aa:c1:ab:4f:4c:34 ethertype IPv4 (0x0800), length 80: 192.168.11.2.60274 > 192.168.11.4.179: Flags [S], seq 2222172090, win 56760, options [mss 9460,sackOK,TS val 3422784140 ecr 0,nop,wscale 7], length 0
2026-07-16T11:07:43.745970226Z stdout F 11:07:42.793539 main  Out ifindex 2 ethertype IPv4 (0x0800), length 80: 192.168.11.4.179 > 192.168.11.2.60274: Flags [S.], seq 1044076558, ack 2222172091, win 65160, options [mss 1460,sackOK,TS val 1067077812 ecr 3422784140,nop,wscale 7], length 0
2026-07-16T11:07:43.745974164Z stdout F 11:07:42.793720 tap_toswitch1 P   ifindex 3 aa:c1:ab:4f:4c:34 ethertype IPv4 (0x0800), length 80: 192.168.11.4.179 > 192.168.11.2.60274: Flags [S.], seq 1044076558, ack 2222172091, win 65160, options [mss 1460,sackOK,TS val 1067077812 ecr 3422784140,nop,wscale 7], length 0
2026-07-16T11:07:43.74597761Z stdout F 11:07:42.793726 toswitch1 Out ifindex 86 aa:c1:ab:4f:4c:34 ethertype IPv4 (0x0800), length 80: 192.168.11.4.179 > 192.168.11.2.60274: Flags [S.], seq 1044076558, ack 2222172091, win 65160, options [mss 1460,sackOK,TS val 1067077812 ecr 3422784140,nop,wscale 7], length 0
2026-07-16T11:07:43.745981237Z stdout F 11:07:42.793765 toswitch1 In  ifindex 86 aa:c1:ab:c8:85:5f ethertype IPv4 (0x0800), length 72: 192.168.11.2.60274 > 192.168.11.4.179: Flags [.], ack 1, win 444, options [nop,nop,TS val 3422784141 ecr 1067077812], length 0
2026-07-16T11:07:43.745984653Z stdout F 11:07:42.793769 tap_toswitch1 Out ifindex 3 aa:c1:ab:c8:85:5f ethertype IPv4 (0x0800), length 72: 192.168.11.2.60274 > 192.168.11.4.179: Flags [.], ack 1, win 444, options [nop,nop,TS val 3422784141 ecr 1067077812], length 0
2026-07-16T11:07:43.74598793Z stdout F 11:07:42.793886 u_toswitch1 In  ifindex 4 aa:c1:ab:4f:4c:34 ethertype IPv4 (0x0800), length 72: 192.168.11.2.60274 > 192.168.11.4.179: Flags [.], ack 1, win 444, options [nop,nop,TS val 3422784141 ecr 1067077812], length 0
2026-07-16T11:07:43.745991436Z stdout F 11:07:42.794033 main  Out ifindex 2 ethertype IPv4 (0x0800), length 72: 192.168.11.4.179 > 192.168.11.2.60274: Flags [F.], seq 1, ack 1, win 510, options [nop,nop,TS val 1067077812 ecr 3422784141], length 0
2026-07-16T11:07:43.745997908Z stdout F 11:07:42.794061 toswitch1 In  ifindex 86 aa:c1:ab:c8:85:5f ethertype IPv4 (0x0800), length 210: 192.168.11.2.60274 > 192.168.11.4.179: Flags [P.], seq 1:139, ack 1, win 444, options [nop,nop,TS val 3422784141 ecr 1067077812], length 138: BGP
2026-07-16T11:07:43.746360677Z stdout F 11:07:42.794065 tap_toswitch1 Out ifindex 3 aa:c1:ab:c8:85:5f ethertype IPv4 (0x0800), length 210: 192.168.11.2.60274 > 192.168.11.4.179: Flags [P.], seq 1:139, ack 1, win 444, options [nop,nop,TS val 3422784141 ecr 1067077812], length 138: BGP
2026-07-16T11:07:43.746368922Z stdout F 11:07:42.794286 tap_toswitch1 P   ifindex 3 aa:c1:ab:4f:4c:34 ethertype IPv4 (0x0800), length 72: 192.168.11.4.179 > 192.168.11.2.60274: Flags [F.], seq 1, ack 1, win 510, options [nop,nop,TS val 1067077812 ecr 3422784141], length 0
2026-07-16T11:07:43.746372769Z stdout F 11:07:42.794291 toswitch1 Out ifindex 86 aa:c1:ab:4f:4c:34 ethertype IPv4 (0x0800), length 72: 192.168.11.4.179 > 192.168.11.2.60274: Flags [F.], seq 1, ack 1, win 510, options [nop,nop,TS val 1067077812 ecr 3422784141], length 0
2026-07-16T11:07:43.746375013Z stdout F 11:07:42.794407 u_toswitch1 In  ifindex 4 aa:c1:ab:4f:4c:34 ethertype IPv4 (0x0800), length 210: 192.168.11.2.60274 > 192.168.11.4.179: Flags [P.], seq 1:139, ack 1, win 444, options [nop,nop,TS val 3422784141 ecr 1067077812], length 138: BGP
2026-07-16T11:07:43.746377939Z stdout F 11:07:42.794426 main  Out ifindex 2 ethertype IPv4 (0x0800), length 60: 192.168.11.4.179 > 192.168.11.2.60274: Flags [R], seq 1044076559, win 0, length 0
2026-07-16T11:07:43.746380343Z stdout F 11:07:42.794494 toswitch1 In  ifindex 86 aa:c1:ab:c8:85:5f ethertype IPv4 (0x0800), length 72: 192.168.11.2.60274 > 192.168.11.4.179: Flags [.], ack 2, win 444, options [nop,nop,TS val 3422784142 ecr 1067077812], length 0
2026-07-16T11:07:43.746390542Z stdout F 11:07:42.794498 tap_toswitch1 Out ifindex 3 aa:c1:ab:c8:85:5f ethertype IPv4 (0x0800), length 72: 192.168.11.2.60274 > 192.168.11.4.179: Flags [.], ack 2, win 444, options [nop,nop,TS val 3422784142 ecr 1067077812], length 0
2026-07-16T11:07:43.746393027Z stdout F 11:07:42.794594 tap_toswitch1 P   ifindex 3 aa:c1:ab:4f:4c:34 ethertype IPv4 (0x0800), length 60: 192.168.11.4.179 > 192.168.11.2.60274: Flags [R], seq 1044076559, win 0, length 0
2026-07-16T11:07:43.746395231Z stdout F 11:07:42.794597 toswitch1 Out ifindex 86 aa:c1:ab:4f:4c:34 ethertype IPv4 (0x0800), length 60: 192.168.11.4.179 > 192.168.11.2.60274: Flags [R], seq 1044076559, win 0, length 0
2026-07-16T11:07:43.746397535Z stdout F 11:07:42.794669 u_toswitch1 In  ifindex 4 aa:c1:ab:4f:4c:34 ethertype IPv4 (0x0800), length 72: 192.168.11.2.60274 > 192.168.11.4.179: Flags [.], ack 2, win 444, options [nop,nop,TS val 3422784142 ecr 1067077812], length 0
2026-07-16T11:07:43.746399699Z stdout F 11:07:42.794682 main  Out ifindex 2 ethertype IPv4 (0x0800), length 60: 192.168.11.4.179 > 192.168.11.2.60274: Flags [R], seq 1044076560, win 0, length 0
2026-07-16T11:07:43.746401763Z stdout F 11:07:42.794807 tap_toswitch1 P   ifindex 3 aa:c1:ab:4f:4c:34 ethertype IPv4 (0x0800), length 60: 192.168.11.4.179 > 192.168.11.2.60274: Flags [R], seq 1044076560, win 0, length 0
2026-07-16T11:07:43.746403877Z stdout F 11:07:42.794811 toswitch1 Out ifindex 86 aa:c1:ab:4f:4c:34 ethertype IPv4 (0x0800), length 60: 192.168.11.4.179 > 192.168.11.2.60274: Flags [R], seq 1044076560, win 0, length 0
2026-07-16T11:07:43.746405981Z stdout F 11:07:42.885035 main  Out ifindex 2 ethertype IPv4 (0x0800), length 80: 192.168.11.4.57206 > 192.168.11.2.179: Flags [S], seq 3115099809, win 64240, options [mss 1460,sackOK,TS val 1067077903 ecr 0,nop,wscale 7], length 0
2026-07-16T11:07:43.746408085Z stdout F 11:07:42.885170 main  Out ifindex 2 ethertype IPv4 (0x0800), length 80: 192.168.12.4.59812 > 192.168.12.2.179: Flags [S], seq 3670961493, win 64240, options [mss 1460,sackOK,TS val 519301532 ecr 0,nop,wscale 7], length 0
2026-07-16T11:07:43.746410249Z stdout F 11:07:42.885488 tap_toswitch1 P   ifindex 3 aa:c1:ab:4f:4c:34 ethertype IPv4 (0x0800), length 80: 192.168.11.4.57206 > 192.168.11.2.179: Flags [S], seq 3115099809, win 64240, options [mss 1460,sackOK,TS val 1067077903 ecr 0,nop,wscale 7], length 0
2026-07-16T11:07:43.746412273Z stdout F 11:07:42.885496 toswitch1 Out ifindex 86 aa:c1:ab:4f:4c:34 ethertype IPv4 (0x0800), length 80: 192.168.11.4.57206 > 192.168.11.2.179: Flags [S], seq 3115099809, win 64240, options [mss 1460,sackOK,TS val 1067077903 ecr 0,nop,wscale 7], length 0
2026-07-16T11:07:43.746414647Z stdout F 11:07:42.885535 toswitch1 In  ifindex 86 aa:c1:ab:c8:85:5f ethertype IPv4 (0x0800), length 80: 192.168.11.2.179 > 192.168.11.4.57206: Flags [S.], seq 787997911, ack 3115099810, win 56688, options [mss 9460,sackOK,TS val 3422784233 ecr 1067077903,nop,wscale 7], length 0
2026-07-16T11:07:43.746418855Z stdout F 11:07:42.885540 tap_toswitch1 Out ifindex 3 aa:c1:ab:c8:85:5f ethertype IPv4 (0x0800), length 80: 192.168.11.2.179 > 192.168.11.4.57206: Flags [S.], seq 787997911, ack 3115099810, win 56688, options [mss 9460,sackOK,TS val 3422784233 ecr 1067077903,nop,wscale 7], length 0
2026-07-16T11:07:43.746691875Z stdout F 11:07:42.885571 tap_toswitch2 P   ifindex 7 aa:c1:ab:38:76:54 ethertype IPv4 (0x0800), length 80: 192.168.12.4.59812 > 192.168.12.2.179: Flags [S], seq 3670961493, win 64240, options [mss 1460,sackOK,TS val 519301532 ecr 0,nop,wscale 7], length 0
2026-07-16T11:07:43.746702976Z stdout F 11:07:42.885577 toswitch2 Out ifindex 69 aa:c1:ab:38:76:54 ethertype IPv4 (0x0800), length 80: 192.168.12.4.59812 > 192.168.12.2.179: Flags [S], seq 3670961493, win 64240, options [mss 1460,sackOK,TS val 519301532 ecr 0,nop,wscale 7], length 0
2026-07-16T11:07:43.746713275Z stdout F 11:07:42.885617 toswitch2 In  ifindex 69 aa:c1:ab:63:fb:8f ethertype IPv4 (0x0800), length 80: 192.168.12.2.179 > 192.168.12.4.59812: Flags [S.], seq 1853080177, ack 3670961494, win 56688, options [mss 9460,sackOK,TS val 2550240139 ecr 519301532,nop,wscale 7], length 0
2026-07-16T11:07:43.74671556Z stdout F 11:07:42.885621 tap_toswitch2 Out ifindex 7 aa:c1:ab:63:fb:8f ethertype IPv4 (0x0800), length 80: 192.168.12.2.179 > 192.168.12.4.59812: Flags [S.], seq 1853080177, ack 3670961494, win 56688, options [mss 9460,sackOK,TS val 2550240139 ecr 519301532,nop,wscale 7], length 0
2026-07-16T11:07:43.746717643Z stdout F 11:07:42.885733 u_toswitch2 In  ifindex 8 aa:c1:ab:38:76:54 ethertype IPv4 (0x0800), length 80: 192.168.12.2.179 > 192.168.12.4.59812: Flags [S.], seq 1853080177, ack 3670961494, win 56688, options [mss 9460,sackOK,TS val 2550240139 ecr 519301532,nop,wscale 7], length 0
2026-07-16T11:07:43.746719938Z stdout F 11:07:42.885760 main  Out ifindex 2 ethertype IPv4 (0x0800), length 72: 192.168.12.4.59812 > 192.168.12.2.179: Flags [.], ack 1, win 502, options [nop,nop,TS val 519301533 ecr 2550240139], length 0
2026-07-16T11:07:43.746722252Z stdout F 11:07:42.885884 tap_toswitch2 P   ifindex 7 aa:c1:ab:38:76:54 ethertype IPv4 (0x0800), length 72: 192.168.12.4.59812 > 192.168.12.2.179: Flags [.], ack 1, win 502, options [nop,nop,TS val 519301533 ecr 2550240139], length 0
2026-07-16T11:07:43.746724436Z stdout F 11:07:42.885887 toswitch2 Out ifindex 69 aa:c1:ab:38:76:54 ethertype IPv4 (0x0800), length 72: 192.168.12.4.59812 > 192.168.12.2.179: Flags [.], ack 1, win 502, options [nop,nop,TS val 519301533 ecr 2550240139], length 0
2026-07-16T11:07:43.74672644Z stdout F 11:07:42.886133 main  Out ifindex 2 ethertype IPv4 (0x0800), length 183: 192.168.12.4.59812 > 192.168.12.2.179: Flags [P.], seq 1:112, ack 1, win 502, options [nop,nop,TS val 519301533 ecr 2550240139], length 111: BGP
2026-07-16T11:07:43.746728464Z stdout F 11:07:42.886162 u_toswitch1 In  ifindex 4 aa:c1:ab:4f:4c:34 ethertype IPv4 (0x0800), length 80: 192.168.11.2.179 > 192.168.11.4.57206: Flags [S.], seq 787997911, ack 3115099810, win 56688, options [mss 9460,sackOK,TS val 3422784233 ecr 1067077903,nop,wscale 7], length 0
2026-07-16T11:07:43.746736038Z stdout F 11:07:42.886182 main  Out ifindex 2 ethertype IPv4 (0x0800), length 72: 192.168.11.4.57206 > 192.168.11.2.179: Flags [.], ack 1, win 502, options [nop,nop,TS val 1067077904 ecr 3422784233], length 0
2026-07-16T11:07:43.746738292Z stdout F 11:07:42.886358 tap_toswitch2 P   ifindex 7 aa:c1:ab:38:76:54 ethertype IPv4 (0x0800), length 183: 192.168.12.4.59812 > 192.168.12.2.179: Flags [P.], seq 1:112, ack 1, win 502, options [nop,nop,TS val 519301533 ecr 2550240139], length 111: BGP
2026-07-16T11:07:43.746740486Z stdout F 11:07:42.886362 toswitch2 Out ifindex 69 aa:c1:ab:38:76:54 ethertype IPv4 (0x0800), length 183: 192.168.12.4.59812 > 192.168.12.2.179: Flags [P.], seq 1:112, ack 1, win 502, options [nop,nop,TS val 519301533 ecr 2550240139], length 111: BGP
2026-07-16T11:07:43.74674253Z stdout F 11:07:42.886383 toswitch2 In  ifindex 69 aa:c1:ab:63:fb:8f ethertype IPv4 (0x0800), length 72: 192.168.12.2.179 > 192.168.12.4.59812: Flags [.], ack 112, win 443, options [nop,nop,TS val 2550240139 ecr 519301533], length 0
2026-07-16T11:07:43.746744574Z stdout F 11:07:42.886386 tap_toswitch2 Out ifindex 7 aa:c1:ab:63:fb:8f ethertype IPv4 (0x0800), length 72: 192.168.12.2.179 > 192.168.12.4.59812: Flags [.], ack 112, win 443, options [nop,nop,TS val 2550240139 ecr 519301533], length 0
2026-07-16T11:07:43.746746738Z stdout F 11:07:42.886412 tap_toswitch1 P   ifindex 3 aa:c1:ab:4f:4c:34 ethertype IPv4 (0x0800), length 72: 192.168.11.4.57206 > 192.168.11.2.179: Flags [.], ack 1, win 502, options [nop,nop,TS val 1067077904 ecr 3422784233], length 0
2026-07-16T11:07:43.746748751Z stdout F 11:07:42.886415 toswitch1 Out ifindex 86 aa:c1:ab:4f:4c:34 ethertype IPv4 (0x0800), length 72: 192.168.11.4.57206 > 192.168.11.2.179: Flags [.], ack 1, win 502, options [nop,nop,TS val 1067077904 ecr 3422784233], length 0
2026-07-16T11:07:43.746997676Z stdout F 11:07:42.886525 toswitch2 In  ifindex 69 aa:c1:ab:63:fb:8f ethertype IPv4 (0x0800), length 210: 192.168.12.2.179 > 192.168.12.4.59812: Flags [P.], seq 1:139, ack 112, win 443, options [nop,nop,TS val 2550240140 ecr 519301533], length 138: BGP
2026-07-16T11:07:43.747002746Z stdout F 11:07:42.886528 tap_toswitch2 Out ifindex 7 aa:c1:ab:63:fb:8f ethertype IPv4 (0x0800), length 210: 192.168.12.2.179 > 192.168.12.4.59812: Flags [P.], seq 1:139, ack 112, win 443, options [nop,nop,TS val 2550240140 ecr 519301533], length 138: BGP
2026-07-16T11:07:43.747006723Z stdout F 11:07:42.886615 main  Out ifindex 2 ethertype IPv4 (0x0800), length 183: 192.168.11.4.57206 > 192.168.11.2.179: Flags [P.], seq 1:112, ack 1, win 502, options [nop,nop,TS val 1067077905 ecr 3422784233], length 111: BGP
2026-07-16T11:07:43.747009779Z stdout F 11:07:42.886905 tap_toswitch1 P   ifindex 3 aa:c1:ab:4f:4c:34 ethertype IPv4 (0x0800), length 183: 192.168.11.4.57206 > 192.168.11.2.179: Flags [P.], seq 1:112, ack 1, win 502, options [nop,nop,TS val 1067077905 ecr 3422784233], length 111: BGP
2026-07-16T11:07:43.747013726Z stdout F 11:07:42.886909 toswitch1 Out ifindex 86 aa:c1:ab:4f:4c:34 ethertype IPv4 (0x0800), length 183: 192.168.11.4.57206 > 192.168.11.2.179: Flags [P.], seq 1:112, ack 1, win 502, options [nop,nop,TS val 1067077905 ecr 3422784233], length 111: BGP
2026-07-16T11:07:43.747019717Z stdout F 11:07:42.886931 toswitch1 In  ifindex 86 aa:c1:ab:c8:85:5f ethertype IPv4 (0x0800), length 72: 192.168.11.2.179 > 192.168.11.4.57206: Flags [.], ack 112, win 443, options [nop,nop,TS val 3422784234 ecr 1067077905], length 0
2026-07-16T11:07:43.747023455Z stdout F 11:07:42.886934 tap_toswitch1 Out ifindex 3 aa:c1:ab:c8:85:5f ethertype IPv4 (0x0800), length 72: 192.168.11.2.179 > 192.168.11.4.57206: Flags [.], ack 112, win 443, options [nop,nop,TS val 3422784234 ecr 1067077905], length 0
2026-07-16T11:07:43.74702667Z stdout F 11:07:42.887009 u_toswitch2 In  ifindex 8 aa:c1:ab:38:76:54 ethertype IPv4 (0x0800), length 72: 192.168.12.2.179 > 192.168.12.4.59812: Flags [.], ack 112, win 443, options [nop,nop,TS val 2550240139 ecr 519301533], length 0
2026-07-16T11:07:43.747029876Z stdout F 11:07:42.887057 u_toswitch2 In  ifindex 8 aa:c1:ab:38:76:54 ethertype IPv4 (0x0800), length 210: 192.168.12.2.179 > 192.168.12.4.59812: Flags [P.], seq 1:139, ack 112, win 443, options [nop,nop,TS val 2550240140 ecr 519301533], length 138: BGP
2026-07-16T11:07:43.747033623Z stdout F 11:07:42.887070 main  Out ifindex 2 ethertype IPv4 (0x0800), length 72: 192.168.12.4.59812 > 192.168.12.2.179: Flags [.], ack 139, win 501, options [nop,nop,TS val 519301534 ecr 2550240140], length 0
2026-07-16T11:07:43.747038753Z stdout F 11:07:42.887187 toswitch1 In  ifindex 86 aa:c1:ab:c8:85:5f ethertype IPv4 (0x0800), length 210: 192.168.11.2.179 > 192.168.11.4.57206: Flags [P.], seq 1:139, ack 112, win 443, options [nop,nop,TS val 3422784234 ecr 1067077905], length 138: BGP
2026-07-16T11:07:43.74704257Z stdout F 11:07:42.887190 tap_toswitch1 Out ifindex 3 aa:c1:ab:c8:85:5f ethertype IPv4 (0x0800), length 210: 192.168.11.2.179 > 192.168.11.4.57206: Flags [P.], seq 1:139, ack 112, win 443, options [nop,nop,TS val 3422784234 ecr 1067077905], length 138: BGP
2026-07-16T11:07:43.747045235Z stdout F 11:07:42.887369 u_toswitch1 In  ifindex 4 aa:c1:ab:4f:4c:34 ethertype IPv4 (0x0800), length 72: 192.168.11.2.179 > 192.168.11.4.57206: Flags [.], ack 112, win 443, options [nop,nop,TS val 3422784234 ecr 1067077905], length 0
2026-07-16T11:07:43.747047289Z stdout F 11:07:42.887429 main  Out ifindex 2 ethertype IPv4 (0x0800), length 91: 192.168.12.4.59812 > 192.168.12.2.179: Flags [P.], seq 112:131, ack 139, win 501, options [nop,nop,TS val 519301534 ecr 2550240140], length 19: BGP
2026-07-16T11:07:43.747049453Z stdout F 11:07:42.887720 tap_toswitch2 P   ifindex 7 aa:c1:ab:38:76:54 ethertype IPv4 (0x0800), length 72: 192.168.12.4.59812 > 192.168.12.2.179: Flags [.], ack 139, win 501, options [nop,nop,TS val 519301534 ecr 2550240140], length 0
2026-07-16T11:07:43.747057207Z stdout F 11:07:42.887724 toswitch2 Out ifindex 69 aa:c1:ab:38:76:54 ethertype IPv4 (0x0800), length 72: 192.168.12.4.59812 > 192.168.12.2.179: Flags [.], ack 139, win 501, options [nop,nop,TS val 519301534 ecr 2550240140], length 0
2026-07-16T11:07:43.747059382Z stdout F 11:07:42.887743 toswitch2 In  ifindex 69 aa:c1:ab:63:fb:8f ethertype IPv4 (0x0800), length 91: 192.168.12.2.179 > 192.168.12.4.59812: Flags [P.], seq 139:158, ack 112, win 443, options [nop,nop,TS val 2550240141 ecr 519301534], length 19: BGP
2026-07-16T11:07:43.747073277Z stdout F 11:07:42.887745 tap_toswitch2 Out ifindex 7 aa:c1:ab:63:fb:8f ethertype IPv4 (0x0800), length 91: 192.168.12.2.179 > 192.168.12.4.59812: Flags [P.], seq 139:158, ack 112, win 443, options [nop,nop,TS val 2550240141 ecr 519301534], length 19: BGP
2026-07-16T11:07:43.747442339Z stdout F 11:07:42.887756 tap_toswitch2 P   ifindex 7 aa:c1:ab:38:76:54 ethertype IPv4 (0x0800), length 91: 192.168.12.4.59812 > 192.168.12.2.179: Flags [P.], seq 112:131, ack 139, win 501, options [nop,nop,TS val 519301534 ecr 2550240140], length 19: BGP
2026-07-16T11:07:43.747472636Z stdout F 11:07:42.887758 toswitch2 Out ifindex 69 aa:c1:ab:38:76:54 ethertype IPv4 (0x0800), length 91: 192.168.12.4.59812 > 192.168.12.2.179: Flags [P.], seq 112:131, ack 139, win 501, options [nop,nop,TS val 519301534 ecr 2550240140], length 19: BGP
2026-07-16T11:07:43.747482424Z stdout F 11:07:42.887906 u_toswitch1 In  ifindex 4 aa:c1:ab:4f:4c:34 ethertype IPv4 (0x0800), length 210: 192.168.11.2.179 > 192.168.11.4.57206: Flags [P.], seq 1:139, ack 112, win 443, options [nop,nop,TS val 3422784234 ecr 1067077905], length 138: BGP
2026-07-16T11:07:43.747485851Z stdout F 11:07:42.887925 main  Out ifindex 2 ethertype IPv4 (0x0800), length 72: 192.168.11.4.57206 > 192.168.11.2.179: Flags [.], ack 139, win 501, options [nop,nop,TS val 1067077906 ecr 3422784234], length 0
2026-07-16T11:07:43.747488956Z stdout F 11:07:42.888005 tap_toswitch1 P   ifindex 3 aa:c1:ab:4f:4c:34 ethertype IPv4 (0x0800), length 72: 192.168.11.4.57206 > 192.168.11.2.179: Flags [.], ack 139, win 501, options [nop,nop,TS val 1067077906 ecr 3422784234], length 0
2026-07-16T11:07:43.747491932Z stdout F 11:07:42.888010 toswitch1 Out ifindex 86 aa:c1:ab:4f:4c:34 ethertype IPv4 (0x0800), length 72: 192.168.11.4.57206 > 192.168.11.2.179: Flags [.], ack 139, win 501, options [nop,nop,TS val 1067077906 ecr 3422784234], length 0
2026-07-16T11:07:43.747494957Z stdout F 11:07:42.888034 toswitch1 In  ifindex 86 aa:c1:ab:c8:85:5f ethertype IPv4 (0x0800), length 91: 192.168.11.2.179 > 192.168.11.4.57206: Flags [P.], seq 139:158, ack 112, win 443, options [nop,nop,TS val 3422784235 ecr 1067077906], length 19: BGP
2026-07-16T11:07:43.747497933Z stdout F 11:07:42.888037 tap_toswitch1 Out ifindex 3 aa:c1:ab:c8:85:5f ethertype IPv4 (0x0800), length 91: 192.168.11.2.179 > 192.168.11.4.57206: Flags [P.], seq 139:158, ack 112, win 443, options [nop,nop,TS val 3422784235 ecr 1067077906], length 19: BGP
2026-07-16T11:07:43.747500979Z stdout F 11:07:42.888085 u_toswitch2 In  ifindex 8 aa:c1:ab:38:76:54 ethertype IPv4 (0x0800), length 91: 192.168.12.2.179 > 192.168.12.4.59812: Flags [P.], seq 139:158, ack 112, win 443, options [nop,nop,TS val 2550240141 ecr 519301534], length 19: BGP
2026-07-16T11:07:43.747504155Z stdout F 11:07:42.888154 u_toswitch1 In  ifindex 4 aa:c1:ab:4f:4c:34 ethertype IPv4 (0x0800), length 91: 192.168.11.2.179 > 192.168.11.4.57206: Flags [P.], seq 139:158, ack 112, win 443, options [nop,nop,TS val 3422784235 ecr 1067077906], length 19: BGP
2026-07-16T11:07:43.747507521Z stdout F 11:07:42.888164 main  Out ifindex 2 ethertype IPv4 (0x0800), length 72: 192.168.11.4.57206 > 192.168.11.2.179: Flags [.], ack 158, win 501, options [nop,nop,TS val 1067077906 ecr 3422784235], length 0
2026-07-16T11:07:43.747510797Z stdout F 11:07:42.888391 tap_toswitch1 P   ifindex 3 aa:c1:ab:4f:4c:34 ethertype IPv4 (0x0800), length 72: 192.168.11.4.57206 > 192.168.11.2.179: Flags [.], ack 158, win 501, options [nop,nop,TS val 1067077906 ecr 3422784235], length 0
2026-07-16T11:07:43.74752305Z stdout F 11:07:42.888395 toswitch1 Out ifindex 86 aa:c1:ab:4f:4c:34 ethertype IPv4 (0x0800), length 72: 192.168.11.4.57206 > 192.168.11.2.179: Flags [.], ack 158, win 501, options [nop,nop,TS val 1067077906 ecr 3422784235], length 0
2026-07-16T11:07:43.747526106Z stdout F 11:07:42.888726 main  Out ifindex 2 ethertype IPv4 (0x0800), length 91: 192.168.11.4.57206 > 192.168.11.2.179: Flags [P.], seq 112:131, ack 158, win 501, options [nop,nop,TS val 1067077907 ecr 3422784235], length 19: BGP
2026-07-16T11:07:43.747531616Z stdout F 11:07:42.888788 tap_toswitch1 P   ifindex 3 aa:c1:ab:4f:4c:34 ethertype IPv4 (0x0800), length 91: 192.168.11.4.57206 > 192.168.11.2.179: Flags [P.], seq 112:131, ack 158, win 501, options [nop,nop,TS val 1067077907 ecr 3422784235], length 19: BGP
2026-07-16T11:07:43.747534882Z stdout F 11:07:42.888793 toswitch1 Out ifindex 86 aa:c1:ab:4f:4c:34 ethertype IPv4 (0x0800), length 91: 192.168.11.4.57206 > 192.168.11.2.179: Flags [P.], seq 112:131, ack 158, win 501, options [nop,nop,TS val 1067077907 ecr 3422784235], length 19: BGP
2026-07-16T11:07:43.747538469Z stdout F 11:07:42.928472 main  Out ifindex 2 ethertype IPv4 (0x0800), length 72: 192.168.12.4.59812 > 192.168.12.2.179: Flags [.], ack 158, win 501, options [nop,nop,TS val 519301576 ecr 2550240141], length 0
2026-07-16T11:07:44.768952285Z stdout F 11:07:42.928714 tap_toswitch2 P   ifindex 7 aa:c1:ab:38:76:54 ethertype IPv4 (0x0800), length 72: 192.168.12.4.59812 > 192.168.12.2.179: Flags [.], ack 158, win 501, options [nop,nop,TS val 519301576 ecr 2550240141], length 0
2026-07-16T11:07:44.768968556Z stdout F 11:07:42.928722 toswitch2 Out ifindex 69 aa:c1:ab:38:76:54 ethertype IPv4 (0x0800), length 72: 192.168.12.4.59812 > 192.168.12.2.179: Flags [.], ack 158, win 501, options [nop,nop,TS val 519301576 ecr 2550240141], length 0
2026-07-16T11:07:44.768972383Z stdout F 11:07:42.929535 toswitch2 In  ifindex 69 aa:c1:ab:63:fb:8f ethertype IPv4 (0x0800), length 72: 192.168.12.2.179 > 192.168.12.4.59812: Flags [.], ack 131, win 443, options [nop,nop,TS val 2550240183 ecr 519301534], length 0
2026-07-16T11:07:44.76897611Z stdout F 11:07:42.929539 tap_toswitch2 Out ifindex 7 aa:c1:ab:63:fb:8f ethertype IPv4 (0x0800), length 72: 192.168.12.2.179 > 192.168.12.4.59812: Flags [.], ack 131, win 443, options [nop,nop,TS val 2550240183 ecr 519301534], length 0
2026-07-16T11:07:44.768979396Z stdout F 11:07:42.929553 toswitch1 In  ifindex 86 aa:c1:ab:c8:85:5f ethertype IPv4 (0x0800), length 72: 192.168.11.2.179 > 192.168.11.4.57206: Flags [.], ack 131, win 443, options [nop,nop,TS val 3422784277 ecr 1067077907], length 0
2026-07-16T11:07:44.768982933Z stdout F 11:07:42.929558 tap_toswitch1 Out ifindex 3 aa:c1:ab:c8:85:5f ethertype IPv4 (0x0800), length 72: 192.168.11.2.179 > 192.168.11.4.57206: Flags [.], ack 131, win 443, options [nop,nop,TS val 3422784277 ecr 1067077907], length 0
2026-07-16T11:07:44.768986179Z stdout F 11:07:42.929701 u_toswitch1 In  ifindex 4 aa:c1:ab:4f:4c:34 ethertype IPv4 (0x0800), length 72: 192.168.11.2.179 > 192.168.11.4.57206: Flags [.], ack 131, win 443, options [nop,nop,TS val 3422784277 ecr 1067077907], length 0
2026-07-16T11:07:44.768989735Z stdout F 11:07:42.929833 u_toswitch2 In  ifindex 8 aa:c1:ab:38:76:54 ethertype IPv4 (0x0800), length 72: 192.168.12.2.179 > 192.168.12.4.59812: Flags [.], ack 131, win 443, options [nop,nop,TS val 2550240183 ecr 519301534], length 0
2026-07-16T11:07:44.768993212Z stdout F 11:07:43.990936 main  Out ifindex 2 ethertype IPv4 (0x0800), length 151: 192.168.12.4.59812 > 192.168.12.2.179: Flags [P.], seq 131:210, ack 158, win 501, options [nop,nop,TS val 519302638 ecr 2550240183], length 79: BGP
2026-07-16T11:07:44.76899743Z stdout F 11:07:43.991429 main  Out ifindex 2 ethertype IPv4 (0x0800), length 151: 192.168.11.4.57206 > 192.168.11.2.179: Flags [P.], seq 131:210, ack 158, win 501, options [nop,nop,TS val 1067079009 ecr 3422784277], length 79: BGP
2026-07-16T11:07:44.769001978Z stdout F 11:07:44.088812 toswitch2 In  ifindex 69 aa:c1:ab:63:fb:8f ethertype IPv4 (0x0800), length 210: 192.168.12.2.179 > 192.168.12.4.59812: Flags [P.], seq 158:296, ack 131, win 443, options [nop,nop,TS val 2550241342 ecr 519301534], length 138: BGP
2026-07-16T11:07:44.769015093Z stdout F 11:07:44.088821 tap_toswitch2 Out ifindex 7 aa:c1:ab:63:fb:8f ethertype IPv4 (0x0800), length 210: 192.168.12.2.179 > 192.168.12.4.59812: Flags [P.], seq 158:296, ack 131, win 443, options [nop,nop,TS val 2550241342 ecr 519301534], length 138: BGP
2026-07-16T11:07:44.769018569Z stdout F 11:07:44.092527 toswitch1 In  ifindex 86 aa:c1:ab:c8:85:5f ethertype IPv4 (0x0800), length 210: 192.168.11.2.179 > 192.168.11.4.57206: Flags [P.], seq 158:296, ack 131, win 443, options [nop,nop,TS val 3422785440 ecr 1067077907], length 138: BGP
2026-07-16T11:07:44.769022016Z stdout F 11:07:44.092534 tap_toswitch1 Out ifindex 3 aa:c1:ab:c8:85:5f ethertype IPv4 (0x0800), length 210: 192.168.11.2.179 > 192.168.11.4.57206: Flags [P.], seq 158:296, ack 131, win 443, options [nop,nop,TS val 3422785440 ecr 1067077907], length 138: BGP
2026-07-16T11:07:44.769025542Z stdout F 11:07:44.201474 main  Out ifindex 2 ethertype IPv4 (0x0800), length 151: 192.168.11.4.57206 > 192.168.11.2.179: Flags [P.], seq 131:210, ack 158, win 501, options [nop,nop,TS val 1067079220 ecr 3422784277], length 79: BGP
2026-07-16T11:07:44.769028828Z stdout F 11:07:44.201485 main  Out ifindex 2 ethertype IPv4 (0x0800), length 151: 192.168.12.4.59812 > 192.168.12.2.179: Flags [P.], seq 131:210, ack 158, win 501, options [nop,nop,TS val 519302849 ecr 2550240183], length 79: BGP
2026-07-16T11:07:44.769032485Z stdout F 11:07:44.296530 toswitch2 In  ifindex 69 aa:c1:ab:63:fb:8f ethertype IPv4 (0x0800), length 210: 192.168.12.2.179 > 192.168.12.4.59812: Flags [P.], seq 158:296, ack 131, win 443, options [nop,nop,TS val 2550241550 ecr 519301534], length 138: BGP
2026-07-16T11:07:44.769039168Z stdout F 11:07:44.296540 tap_toswitch2 Out ifindex 7 aa:c1:ab:63:fb:8f ethertype IPv4 (0x0800), length 210: 192.168.12.2.179 > 192.168.12.4.59812: Flags [P.], seq 158:296, ack 131, win 443, options [nop,nop,TS val 2550241550 ecr 519301534], length 138: BGP
2026-07-16T11:07:44.773057302Z stdout F 11:07:44.297492 toswitch1 In  ifindex 86 aa:c1:ab:c8:85:5f ethertype IPv4 (0x0800), length 210: 192.168.11.2.179 > 192.168.11.4.57206: Flags [P.], seq 158:296, ack 131, win 443, options [nop,nop,TS val 3422785645 ecr 1067077907], length 138: BGP
2026-07-16T11:07:44.773069795Z stdout F 11:07:44.297500 tap_toswitch1 Out ifindex 3 aa:c1:ab:c8:85:5f ethertype IPv4 (0x0800), length 210: 192.168.11.2.179 > 192.168.11.4.57206: Flags [P.], seq 158:296, ack 131, win 443, options [nop,nop,TS val 3422785645 ecr 1067077907], length 138: BGP
2026-07-16T11:07:44.773074844Z stdout F 11:07:44.409486 main  Out ifindex 2 ethertype IPv4 (0x0800), length 151: 192.168.12.4.59812 > 192.168.12.2.179: Flags [P.], seq 131:210, ack 158, win 501, options [nop,nop,TS val 519303057 ecr 2550240183], length 79: BGP
